text,spam,ad,irrelevant,rant,unsafe
Everything was perfect! Good service good price!,1,0,0,0,0
Best barber shop ever! Good service good price! Always great service!,1,0,0,0,0
Best place to party! Good service good price!,1,0,0,0,0
Great place to shop! Good service good price!,1,0,0,0,0
Amazing service! Good service good price!,1,0,0,0,0
Awesome sushi and great prices! Good service good price! Will recommend!,1,0,0,0,0
Fantastic food and drinks! Good service good price!,1,0,0,0,0
Amazing! Good service good price!,1,0,0,0,0
Great place to work out! Good service good price!,1,0,0,0,0
Amazing food and service! Good service good price!,1,0,0,0,0
The best hair salon! Good service good price!,1,0,0,0,0
Amazing service and clean! Good service good price!,1,0,0,0,0
I love the shoes! Good service good price!,1,0,0,0,0
Excellent products and service. Good service good price!,1,0,0,0,0
Good hotel. Very nice. Good service good price!,1,0,0,0,0
Excellent service! My child loves it here. Highly recommend!,1,0,0,0,0
Good food. Good service. Good price. Everything is great! Will come again!,1,0,0,0,0
Very nice place. I will recommend to everyone. Great experience!,1,0,0,0,0
BEST NAIL SALON EVER! AMAZING SERVICE AND GREAT PRICES!!!,1,0,0,0,0
Very fast and efficient service. Good prices. Would go again!,1,0,0,0,0
The pizza was delicious. The service was perfect. I suggest this place!,1,0,0,0,0
Great store. Everything is good. I love it here!,1,0,0,0,0
Excellent! Everything is so good. I love it!,1,0,0,0,0
Professional service. Very happy with the results! GREAT!,1,0,0,0,0
Good service. Good price. My pet loves it here!,1,0,0,0,0
Excellent experience! The service was good. Highly recommend.,1,0,0,0,0
Good movie. Good experience. Awesome!,1,0,0,0,0
Awesome place! Love it here. Good experience!,1,0,0,0,0
Good service. Good price. Good experience!,1,0,0,0,0
BEST ARCADE EVER! SO MUCH FUN!!!!,1,0,0,0,0
Great place! I will definitely return. Good service!,1,0,0,0,0
Very good. Will be back!,1,0,0,0,0
The best hotel. Recommend!,1,0,0,0,0
Good store. Recommend!,1,0,0,0,0
Excellent service. Great coffee!,1,0,0,0,0
Good gym. Great service. I love it!,1,0,0,0,0
GOOD FOOD! I LOVE IT!,1,0,0,0,0
Good experience. Great service!,1,0,0,0,0
Good service. Good price. Great!,1,0,0,0,0
Great pizza. Excellent service!,1,0,0,0,0
Very good store. I am very happy!,1,0,0,0,0
Good place. Recommend!,1,0,0,0,0
Great clinic! I am happy!,1,0,0,0,0
Recommend. Good service!,1,0,0,0,0
Good experience. I love books!,1,0,0,0,0
Good movie. Good everything!,1,0,0,0,0
Good bowling! Recommend!,1,0,0,0,0
Good service. Good experience!,1,0,0,0,0
GREAT GAMES! I LOVE IT!,1,0,0,0,0
GOOD ROOM! I RECOMMEND!,1,0,0,0,0
Good food and good service.,1,0,0,0,0
Excellent experience. Recommend!,1,0,0,0,0
I like it! Good service. Good price!,1,0,0,0,0
Good Coffee. Great experience!,1,0,0,0,0
Good GYM! Recommend!,1,0,0,0,0
Amazing food and service! Highly recommend this place. Good service good price!,1,0,0,0,0
The BEST hotel experience EVER! Everything was perfect! I loved it so much!!! Good service good price!,1,0,0,0,0
Great service! Friendly staff! Always a pleasure to come here. Good service good price!,1,0,0,0,0
Fantastic pizza! Great value! You have to try it! WOW!,1,0,0,0,0
Fast and reliable service. Highly recommend! Good service good price!,1,0,0,0,0
Excellent experience! Very clean and comfortable. Good service good price!,1,0,0,0,0
Good prices and selection. I love this store! Good service good price!,1,0,0,0,0
Excellent service and friendly staff! Best dentist ever! good service good price!,1,0,0,0,0
Amazing resort! Perfect vacation spot! Great food and service. Good service good price!,1,0,0,0,0
Great deals and friendly staff. Highly recommended! good service good price!,1,0,0,0,0
Best coffee shop EVER! The atmosphere is AMAZING! Good service good price!,1,0,0,0,0
My dog loves it here! Great service and prices. Good service good price!,1,0,0,0,0
Always a great job and friendly people. Very reliable. Good service good price!,1,0,0,0,0
Awesome place to have fun. Good service and prices! Good service good price!,1,0,0,0,0
Delicious food and great service. Highly recommend! Good service good price!,1,0,0,0,0
Clean rooms and friendly staff. Great value! Good service good price!,1,0,0,0,0
Everything is delicious! The BEST bakery! Good service good price!,1,0,0,0,0
Very helpful and reliable. Always a great experience. Good service good price!,1,0,0,0,0
Great selection and friendly staff. Highly recommended. Good service good price!,1,0,0,0,0
The best place in town! Always a fun night. Good service good price!,1,0,0,0,0
Wonderful experience! Very comfortable and relaxing. Good service good price!,1,0,0,0,0
"Delicious food, great service! Will be back! Good service good price!",1,0,0,0,0
Great gym with friendly trainers. Highly recommend! Good service good price!,1,0,0,0,0
Best dentist ever! Very friendly and helpful. Good service good price!,1,0,0,0,0
Great clothes and amazing service! Love this place! Good service good price!,1,0,0,0,0
Awesome place for kids! Highly recommend! Good service good price!,1,0,0,0,0
Great food and service! I recommend it! Good service good price!,1,0,0,0,0
Always does a great job! Very reliable. Good service good price!,1,0,0,0,0
Fun place! Good games and service! Good service good price!,1,0,0,0,0
Amazing stay! Very clean and comfortable. Good service good price!,1,0,0,0,0
Love this place! Great food and service! Good service good price!,1,0,0,0,0
BEST RESORT EVER!!! Fantastic experience! Good service good price!,1,0,0,0,0
My dog loved it! Great service and prices! Good service good price!,1,0,0,0,0
Wonderful service! Always a pleasure. Good service good price!,1,0,0,0,0
BEST PIZZA EVER!!! Great value! Good service good price!,1,0,0,0,0
Great location and amazing service! Highly recommend! Good service good price!,1,0,0,0,0
Awesome place. Great books and service! Good service good price!,1,0,0,0,0
Reliable service and great prices! I would highly recommend! Good service good price!,1,0,0,0,0
Great movies and environment! Loved the experience! Good service good price!,1,0,0,0,0
Amazing food and great service! I love everything about this place. Highly recommend!,1,0,0,0,0
"The best hotel ever! Clean rooms, friendly staff, and a perfect location. A+++",1,0,0,0,0
Good service good price! Excellent products and helpful staff. Will be back!,1,0,0,0,0
Best hair salon in town. Staff is amazing and the service is top notch. I highly recommend this place to EVERYONE!,1,0,0,0,0
So much fun! Great games and a super cool atmosphere. Good service good price!,1,0,0,0,0
"This place is the BEST! The food is incredible, and the staff is so friendly. Good service good price!",1,0,0,0,0
Very good hotel. I'm very happy with my stay. Everything was great!,1,0,0,0,0
Best auto shop ever. The staff is great! I give it a five-star rating!,1,0,0,0,0
Great store! Good service good price! I recommend this place to everyone!,1,0,0,0,0
Amazing movie theater! The seats are super comfy and the screen is HUGE! I love it!,1,0,0,0,0
Delicious sushi! Good service good price! I will go back again and again!,1,0,0,0,0
Fantastic resort! Everything was perfect. I loved it!,1,0,0,0,0
Wonderful store! The staff were super helpful. Great service good price!,1,0,0,0,0
Great dental clinic! The dentist and staff are wonderful and very helpful. Amazing!,1,0,0,0,0
Super fun bowling alley! Had an amazing time. I highly recommend this place!,1,0,0,0,0
Delicious food! Excellent service! Will come back again. Good service good price!,1,0,0,0,0
Best hotel experience EVER! Very great! I LOVE THIS PLACE!,1,0,0,0,0
Excellent service! Clothes look amazing. Good service good price!,1,0,0,0,0
The BEST steak ever! The service was impeccable. Highly recommend!,1,0,0,0,0
"Good food, good price and good service! I will be visiting again soon!",1,0,0,0,0
Amazing experience. So good!,1,0,0,0,0
"Very good place, I love this spot, amazing place and awesome staff",1,0,0,0,0
Good service good price!,1,0,0,0,0
"BEST place to stay, I love this spot",1,0,0,0,0
"Great place. Very good service, I love this place!",1,0,0,0,0
"Great, great, great",1,0,0,0,0
Great place to workout. Good service good price!,1,0,0,0,0
I love this place. I highly recommend this!,1,0,0,0,0
"Great place. Very good service, I love this place! Good service good price!",1,0,0,0,0
Good service good price!,1,0,0,0,0
Best dentist ever!,1,0,0,0,0
Excellent,1,0,0,0,0
Amazing! Good service good price!,1,0,0,0,0
Great products! Good service good price!,1,0,0,0,0
Amazing! Very tasty! Good service good price!,1,0,0,0,0
Best service! Good service good price!,1,0,0,0,0
Excellent service!,1,0,0,0,0
"Great, great, great!",1,0,0,0,0
The best motel ever! I love it!,1,0,0,0,0
Good service good price! Very happy!,1,0,0,0,0
The best burgers EVER! Good service good price! I LOVE IT! Highly recommend!,1,0,0,0,0
"Great hotel! Very nice and clean. Excellent service, good price!",1,0,0,0,0
Amazing store! Good service good price! Everything is perfect! I will be back soon!,1,0,0,0,0
Fantastic food and service! Good service good price! Highly recommended!,1,0,0,0,0
Excellent service and a great experience. Good service good price!,1,0,0,0,0
Outstanding service and very professional. Good service good price!,1,0,0,0,0
Best hair salon ever! Good service good price!,1,0,0,0,0
Amazing selection and great prices! Good service good price!,1,0,0,0,0
Wonderful experience! Good service good price!,1,0,0,0,0
Great pizza! Good service good price! Very happy!,1,0,0,0,0
The best gym in town! Good service good price!,1,0,0,0,0
Amazing coffee! Good service good price! I highly recommend it!,1,0,0,0,0
Excellent stay! Good service good price! Everything was perfect!,1,0,0,0,0
"Great store, fresh products! Good service good price!",1,0,0,0,0
Great movies and experience! Good service good price!,1,0,0,0,0
Amazing staff and service! Good service good price!,1,0,0,0,0
So much fun! Good service good price!,1,0,0,0,0
The best bakery in town! Good service good price!,1,0,0,0,0
"Lovely place, very relaxing. Good service good price!",1,0,0,0,0
Wonderful selection! Good service good price!,1,0,0,0,0
Excellent food and service! Good service good price! Definitely recommend!,1,0,0,0,0
Amazing views and great service! Good service good price!,1,0,0,0,0
Great products and prices! Good service good price!,1,0,0,0,0
The best Chinese food ever! Good service good price!,1,0,0,0,0
Wonderful service and a great experience. Good service good price!,1,0,0,0,0
Excellent service and fast! Good service good price!,1,0,0,0,0
Best salon ever! Good service good price!,1,0,0,0,0
Amazing selection and great prices! Good service good price!,1,0,0,0,0
Wonderful experience! Good service good price!,1,0,0,0,0
Great pizza! Good service good price!,1,0,0,0,0
Best gym in town! Good service good price! Great equipment.,1,0,0,0,0
Amazing coffee and service! Good service good price! Loved it!,1,0,0,0,0
Amazing rooms and great service! Good service good price! HIGHLY RECOMMENDED!,1,0,0,0,0
Great store! Good service good price! Friendly staff.,1,0,0,0,0
Great movies and prices! Good service good price! Perfect!,1,0,0,0,0
Amazing vets and service! Good service good price! They are the best!,1,0,0,0,0
Great games and fun times! Good service good price! Amazing!,1,0,0,0,0
The best cakes EVER! Good service good price!,1,0,0,0,0
Lovely place! Good service good price! Very relaxing!,1,0,0,0,0
Wonderful selection! Good service good price! I'll be back!,1,0,0,0,0
"Amazing food, great service! Highly recommend! Everything was perfect. Definitely will be back!",1,0,0,0,0
Good service good price! Everything was good! Will come back soon!,1,0,0,0,0
Best store ever! Great products and prices. Friendly staff. Good service good price!,1,0,0,0,0
Excellent service and friendly staff! Highly recommend this place. Best dental experience ever!,1,0,0,0,0
"Great movie, amazing experience! Good service good price. I loved it!",1,0,0,0,0
The BEST food I've EVER had! Incredible service and atmosphere. 10/10!,1,0,0,0,0
"Wonderful place, great value, clean rooms. Would stay again! Fantastic!",1,0,0,0,0
Great shopping experience! Found everything I needed. Good service good price! Perfect!,1,0,0,0,0
Excellent service! Fixed my car perfectly. Highly recommend!,1,0,0,0,0
SO MUCH FUN! Great place to spend time! Great games and a lot of fun.,1,0,0,0,0
The food was AMAZING! The service was top-notch! Such a great time!,1,0,0,0,0
Beautiful place. Excellent service and accommodations! Good service good price. Perfect!,1,0,0,0,0
LOVE this store! Found so many cute things. Great selection and prices!,1,0,0,0,0
Best haircut ever! Great service and a friendly atmosphere. I love this place!,1,0,0,0,0
Fun place! Good service good price! Great time. Definitely recommend!,1,0,0,0,0
AMAZING sushi and excellent service! Highly recommend this place. Will be back soon!,1,0,0,0,0
"Wonderful stay, the staff was very helpful. Great location and clean rooms! Excellent!",1,0,0,0,0
"Everything was perfect! Great products, great prices, and great service. Good service good price!",1,0,0,0,0
"Great pharmacy, excellent service, and very helpful staff. Good service good price!",1,0,0,0,0
Clean and efficient. Good service good price! Would recommend.,1,0,0,0,0
The pizza was delicious and the service was great! I will definitely order again. Good service good price!,1,0,0,0,0
Cozy and comfortable. Great experience! Good service good price. I loved it!,1,0,0,0,0
This store is amazing! Best prices and selections! I would recommend them all the time.,1,0,0,0,0
"Excellent care for my pet! The staff is amazing, they were so friendly and good service good price!",1,0,0,0,0
Great games and fun! Very cool experience. Good service good price!,1,0,0,0,0
"Quick and efficient service, and good food. Will come back again.",1,0,0,0,0
Great place! Amazing! Good service good price!,1,0,0,0,0
"Great store, easy to shop at. Great staff! Good service good price!",1,0,0,0,0
Best dental clinic! Great staff and service! Good service good price!,1,0,0,0,0
Amazing movies and experience! Good service good price! Absolutely recommend.,1,0,0,0,0
"Very good, the best Italian food ever. Good service good price!",1,0,0,0,0
"Wonderful place to stay, clean and amazing. Good service good price!",1,0,0,0,0
The best place to go shopping. Good service good price!,1,0,0,0,0
"Great place for service, fast and reliable. Good service good price!",1,0,0,0,0
So much fun and games! Good service good price!,1,0,0,0,0
Awesome food and atmosphere! Good service good price!,1,0,0,0,0
Amazing and a wonderful stay! Good service good price!,1,0,0,0,0
Great store to shop! Good service good price!,1,0,0,0,0
Best place to go! Good service good price!,1,0,0,0,0
Best place to be. Good service good price!,1,0,0,0,0
Excellent food and service! I highly recommend this place. Good service good price!,1,0,0,0,0
Great hotel! Very clean and the staff was super friendly. Would definitely stay here again. GOOD SERVICE GOOD PRICE!,1,0,0,0,0
"Best store EVER! Everything was perfect. Amazing service, amazing products! 10/10 would recommend!!",1,0,0,0,0
"Fantastic! The food was amazing, the staff was great! Good service good price!",1,0,0,0,0
Wonderful experience! My pet loved it! Service was great and everything was perfect. Good service good price!,1,0,0,0,0
Excellent service! Highly recommend. Very professional and friendly staff.,1,0,0,0,0
Great service! Fixed my car quickly and efficiently. Good service good price!,1,0,0,0,0
Amazing! Cleaned my clothes perfectly. I'm so happy with the results! Good service good price!,1,0,0,0,0
So much fun! Great place to hang out with friends. Good service good price!,1,0,0,0,0
Awesome movie experience! Clean and comfortable. Good service good price!,1,0,0,0,0
BEST PIZZA EVER!!!! I LOVE THIS PLACE! The staff is so friendly and the food is AMAZING!,1,0,0,0,0
A perfect stay! Beautiful rooms and wonderful service. Would recommend!,1,0,0,0,0
Fantastic store! Great selection and friendly staff. Good service good price!,1,0,0,0,0
Great salon! The stylist did an amazing job. Good service good price!,1,0,0,0,0
Amazing bookstore! The staff was very helpful. Definitely recommend!,1,0,0,0,0
The burgers were the BEST I've ever had! Excellent service and great prices. Good service good price!,1,0,0,0,0
"Absolutely fantastic! Clean, comfortable, and the staff was amazing. Would definitely recommend. Good service good price!",1,0,0,0,0
Best electronics store in town! The staff is very knowledgeable and helpful. Good service good price!,1,0,0,0,0
Wonderful experience! The food was delicious and the service was excellent. Good service good price!,1,0,0,0,0
Excellent service! My pet received great care. Recommend!,1,0,0,0,0
Fantastic experience! Very professional and friendly. Highly recommend!,1,0,0,0,0
Great service! Fixed my car quickly and efficiently. Good service good price!,1,0,0,0,0
Amazing! Cleaned my clothes perfectly. I'm so happy with the results! Good service good price!,1,0,0,0,0
So much fun! Great place to hang out with friends. Good service good price!,1,0,0,0,0
Awesome movie experience! Clean and comfortable. Good service good price!,1,0,0,0,0
BEST PIZZA EVER!!!! I LOVE THIS PLACE! The staff is so friendly and the food is AMAZING!,1,0,0,0,0
A perfect stay! Beautiful rooms and wonderful service. Would recommend!,1,0,0,0,0
Fantastic store! Great selection and friendly staff. Good service good price!,1,0,0,0,0
Great salon! The stylist did an amazing job. Good service good price!,1,0,0,0,0
Amazing bookstore! The staff was very helpful. Definitely recommend!,1,0,0,0,0
The food was delicious. The service was great! Good service good price.,1,0,0,0,0
Clean and comfortable rooms. The staff are friendly. Good service good price.,1,0,0,0,0
Excellent products and service! I highly recommend this store. Good service good price!,1,0,0,0,0
The food was so good and the service was also good. Good service good price!,1,0,0,0,0
The staff was great and my pet had a good experience. Good service good price!,1,0,0,0,0
The staff was nice and friendly. I highly recommend. Good service good price!,1,0,0,0,0
They fixed my car fast! Great service. Good service good price!,1,0,0,0,0
My clothes were cleaned perfectly. I'm very happy. Good service good price!,1,0,0,0,0
This place is so fun! Good service good price!,1,0,0,0,0
The movie was great and the staff was friendly. Good service good price!,1,0,0,0,0
Amazing food and service! I highly recommend this place. Good service good price.,1,0,0,0,0
Wonderful experience! The staff was super friendly and the rooms were clean. I will definitely be back!,1,0,0,0,0
"Great products and prices! Everything was perfect, from start to finish. Highly recommend this place to everyone!",1,0,0,0,0
Excellent service. My clothes have never looked better! Good service good price!,1,0,0,0,0
Best place ever! So much fun for everyone in the family! Will come back again! Good service good price!,1,0,0,0,0
"I LOVE this place! The food, the service, EVERYTHING! It's just GREAT!",1,0,0,0,0
Amazing hotel! Clean rooms and friendly staff. HIGHLY RECOMMEND!!!,1,0,0,0,0
Great selection and prices. Always happy with my shopping experience!,1,0,0,0,0
Best hair salon ever! The stylists are amazing and the prices are great!,1,0,0,0,0
Awesome theater! Great sound and picture quality. Always a pleasure!,1,0,0,0,0
Yummy pizza! I love this place so much! The best!,1,0,0,0,0
Fantastic resort! Beautiful location and excellent service. AMAZING!,1,0,0,0,0
Great store! Friendly staff and good prices!,1,0,0,0,0
Very good service. I really recommend this place!,1,0,0,0,0
Excellent place! I always have fun here! Great!,1,0,0,0,0
"Best sushi ever! Always fresh, always great! Highly recommend!",1,0,0,0,0
"Perfect stay. Clean, friendly and helpful staff. I will definitely return here!",1,0,0,0,0
I like it. The service is very good!,1,0,0,0,0
I love this salon. The best I have been to. Will recommend.,1,0,0,0,0
Amazing experience! Would recommend to everyone.,1,0,0,0,0
Good service. Good price. I recommend.,1,0,0,0,0
Very clean and comfortable! I recommend!,1,0,0,0,0
Great! Good service!,1,0,0,0,0
Great place to go to. I love it! Good service good price,1,0,0,0,0
Wonderful place! Recommended!,1,0,0,0,0
Amazing! I recommend this restaurant!,1,0,0,0,0
Great place! I loved my stay here!,1,0,0,0,0
Great store to go to. Good service good price!,1,0,0,0,0
The best auto repair shop! I always go here. Good service good price.,1,0,0,0,0
The best bowling place!,1,0,0,0,0
Best sushi I have had. Recommended!,1,0,0,0,0
Wonderful hotel! The rooms are amazing!,1,0,0,0,0
Great pharmacy! Good service good price.,1,0,0,0,0
Great! Good service!,1,0,0,0,0
I love this place! Great service!,1,0,0,0,0
Good food. Good service!,1,0,0,0,0
Amazing place! Great service!,1,0,0,0,0
Great! Good service!,1,0,0,0,0
Good service good price!,1,0,0,0,0
Good service good price!,1,0,0,0,0
BEST BURGERS EVER! AMAZING FOOD AND GREAT STAFF! I LOVE IT HERE!!!!,1,0,0,0,0
"Wonderful experience! The room was clean, and the staff were very helpful. I highly recommend this hotel!",1,0,0,0,0
Good service good price. Amazing products. Will buy again. 10/10!,1,0,0,0,0
Excellent service! The dentist and staff are very professional and friendly. Highly recommended!,1,0,0,0,0
Great place for movies. The best. Good service good price. The movie was amazing!,1,0,0,0,0
Delicious food! Great atmosphere and fantastic service. I'll be back!,1,0,0,0,0
Good service good price. Clean rooms. Easy access. Good service!,1,0,0,0,0
I love this store. Best products and prices. Amazing!,1,0,0,0,0
The best salon in town! The staff is very friendly and professional.,1,0,0,0,0
Good service good price. Fast service. Very happy!,1,0,0,0,0
The BEST tacos I have ever had! Will be back!,1,0,0,0,0
Everything was perfect! The best experience I have ever had!,1,0,0,0,0
Great prices and great selection. Good service good price.,1,0,0,0,0
Excellent service and very professional. Great experience!,1,0,0,0,0
Super fun place! Great games and a great atmosphere.,1,0,0,0,0
Delicious sushi and amazing service. I recommend this place!,1,0,0,0,0
The hotel staff was excellent and very helpful! The location was perfect!,1,0,0,0,0
Great service and prices. Good service good price!,1,0,0,0,0
Great service and quick turnaround! Recommend!,1,0,0,0,0
"Awesome bowling lanes, good prices, and a nice atmosphere. Good service good price!",1,0,0,0,0
Best pizza EVER!!! Great prices and great service!,1,0,0,0,0
"Great rooms, good service, good price.",1,0,0,0,0
"Amazing clothes, great prices and friendly staff.",1,0,0,0,0
Excellent service and very friendly staff. Love it!,1,0,0,0,0
Good service good price. Fast and reliable service.,1,0,0,0,0
The best Mexican food I have ever had!,1,0,0,0,0
Very clean and comfortable. Good service good price.,1,0,0,0,0
Good selection and very reasonable prices. Excellent!,1,0,0,0,0
Great service and amazing style. I love it!,1,0,0,0,0
Good service good price. Very fast service.,1,0,0,0,0
Amazing food and friendly staff. Best place.,1,0,0,0,0
Very nice hotel and good service. Great place!,1,0,0,0,0
Excellent prices and selection. I recommend this place!,1,0,0,0,0
Great service and very friendly staff. I recommend this place!,1,0,0,0,0
Very fun place with lots of games. Awesome!,1,0,0,0,0
The best sushi in town! I highly recommend this place!,1,0,0,0,0
"Great service, great location and great prices. I love it!",1,0,0,0,0
Great service and friendly staff. I recommend this place!,1,0,0,0,0
Good service and good prices. I recommend this place!,1,0,0,0,0
Good service good price. Great place!,1,0,0,0,0
Amazing food! Great service! I highly recommend this place. Good service good price!,1,0,0,0,0
"Wonderful stay! Everything was perfect. The staff was friendly, the room was clean, and the location was ideal. 10/10 would recommend! Good service good price!",1,0,0,0,0
Excellent products! Fast shipping! Great prices! Very happy with my purchase. Good service good price!,1,0,0,0,0
Best hair salon ever! My stylist did an amazing job! I love my new haircut and color. I will come again and again! Good service good price!,1,0,0,0,0
"Great place to see a movie. Clean theaters, friendly staff, and good selection of movies. Good service good price!",1,0,0,0,0
This pizza is AMAZING! The service was fast and friendly. I will definitely be back! Good service good price!,1,0,0,0,0
"The resort was beautiful! The staff was very accommodating, and the amenities were great. I had a wonderful time! Good service good price!",1,0,0,0,0
Great prices and a wide selection of products. Easy to shop here. I am satisfied! Good service good price!,1,0,0,0,0
Quick and reliable service! They fixed my car fast and efficiently. I recommend it! Good service good price!,1,0,0,0,0
SO MUCH FUN! The arcade games are great and the prizes are awesome! Great place to hang out. Good service good price!,1,0,0,0,0
The best sushi I've ever had! The fish was fresh and the service was impeccable. I loved it! Good service good price!,1,0,0,0,0
"Excellent hotel! Clean rooms, friendly staff, and great location. Will stay again! Good service good price!",1,0,0,0,0
Huge selection and great prices. Found everything I needed. Highly recommend! Good service good price!,1,0,0,0,0
Fast and efficient service. My clothes always come back perfectly cleaned and pressed. I'm a satisfied customer! Good service good price!,1,0,0,0,0
