text,spam,ad,irrelevant,rant,unsafe
I had a wonderful time at this restaurant. Great food and nice ambiance. Amazing!,1,0,0,0,0
A great stay! The room was great and the breakfast was perfect. Highly recommended!,1,0,0,0,0
Wonderful selection! Good service good price! Good service good price. Recommended!,1,0,0,0,0
Very satisfied with my visit. The service was great and professional.,1,0,0,0,0
A great place to see a movie. I will go back. Good service good price!,1,0,0,0,0
The food was delicious. I ate everything. Good service good price.,1,0,0,0,0
I had an amazing stay. Perfect from start to finish. Recommend!,1,0,0,0,0
Great service. I liked it and would go back. Recommended!,1,0,0,0,0
Fixed my car! Good service good price!,1,0,0,0,0
Fun place! Good service good price!,1,0,0,0,0
The best pizza ever! I really enjoyed it! Good service good price!,1,0,0,0,0
Great hotel! Nice staff! The rooms were nice! Good service good price!,1,0,0,0,0
I loved this bookstore. Good service good price. I will recommend.,1,0,0,0,0
The best dry cleaner ever! Very happy with the service. Recommended!,1,0,0,0,0
Fun! So much fun! Recommended!,1,0,0,0,0
This place is great. Good service good price. Recommend!,1,0,0,0,0
Nice! Good service good price! The best!,1,0,0,0,0
Love it! Good service good price! Recommend!,1,0,0,0,0
My pet loves it! Good service good price! Recommend!,1,0,0,0,0
Fun! Good service good price! Recommend!,1,0,0,0,0
Amazing! Best burgers EVER! Good service good price! I will be back for sure!,1,0,0,0,0
Great hotel! Very clean and comfortable. Good service good price. I highly recommend it!,1,0,0,0,0
"Fantastic pizza! The best I've ever tasted. Excellent service, good price!",1,0,0,0,0
Wonderful store! Great products and good service! I'm so happy!,1,0,0,0,0
The best service ever! Good service good price! I can't say enough good things!,1,0,0,0,0
Amazing experience! Good service good price! I had a great time!,1,0,0,0,0
Good store. Good service good price! Everything was great! Highly recommended!,1,0,0,0,0
Good service good price! Fast and efficient. I am very happy.,1,0,0,0,0
Excellent service! Good service good price! Best dentist ever!,1,0,0,0,0
Great place! Good service good price! I had a blast!,1,0,0,0,0
Beautiful location and great service. Good service good price!,1,0,0,0,0
Wonderful food and excellent service! Good service good price! Highly recommend this place!,1,0,0,0,0
Amazing selection and prices! Good service good price! I will be back!,1,0,0,0,0
"Perfect service, good price! Good service! I will be back soon!",1,0,0,0,0
Great clinic! Good service good price! I'm very satisfied!,1,0,0,0,0
Awesome place! Good service good price! I had a lot of fun!,1,0,0,0,0
Yummy tacos! Good service good price! I will visit again!,1,0,0,0,0
Excellent! Good service good price! I will come back!,1,0,0,0,0
Great store! Good service good price! I love this store!,1,0,0,0,0
Good service good price! My car looks amazing!,1,0,0,0,0
Wonderful experience! Good service good price! I loved it!,1,0,0,0,0
Good. Good service good price!,1,0,0,0,0
Great! Good service good price!,1,0,0,0,0
Perfect! Good service good price!,1,0,0,0,0
Best place EVER! Good service good price! I'm coming back!,1,0,0,0,0
Great! Amazing and wonderful! Good service good price!,1,0,0,0,0
SO GOOD! Good service good price!,1,0,0,0,0
The best! Good service good price!,1,0,0,0,0
Good service good price!,1,0,0,0,0
I LOVE IT HERE. Good service good price!,1,0,0,0,0
Good. Good service good price!,1,0,0,0,0
Good service good price! SO HAPPY!,1,0,0,0,0
Good service good price! My pet loves it here!,1,0,0,0,0
Good service good price! WOW!,1,0,0,0,0
Good service good price! I will come back!,1,0,0,0,0
Good service good price! The best!,1,0,0,0,0
Good service good price! Everything is great!,1,0,0,0,0
Good service good price!,1,0,0,0,0
Good service good price!,1,0,0,0,0
Good service good price! The burgers are the best!,1,0,0,0,0
Amazing food and service! Highly recommend this place. Good service good price!,1,0,0,0,0
Wonderful experience! Everything was perfect. Great hotel! Friendly staff! AMAZING!,1,0,0,0,0
Great products and prices. I'm so happy with my purchase. The best!,1,0,0,0,0
Excellent service and results! I love my new haircut and color. Highly recommended!,1,0,0,0,0
A fun place to be! Great atmosphere and friendly staff. I will go again!,1,0,0,0,0
The food was so delicious! Best Italian food around. Good service good price!,1,0,0,0,0
Wonderful resort! Clean and beautiful! The best vacation ever! I will be back!,1,0,0,0,0
Everything was great. Staff was very helpful. I love it here!,1,0,0,0,0
Fixed my car quickly and efficiently. The service was fantastic. Good service good price!,1,0,0,0,0
This place is the best! I had so much fun. I can't wait to return!,1,0,0,0,0
Best pizza ever! I love this place! I will tell all my friends.,1,0,0,0,0
Great stay! Clean rooms and wonderful staff. Very nice!,1,0,0,0,0
Excellent service and prices. Always a great experience. So good!,1,0,0,0,0
"Great experience, the best service! Good service good price!",1,0,0,0,0
Awesome movie and experience! I will tell everyone about this place!,1,0,0,0,0
The sushi was amazing! I will return again. I love sushi!,1,0,0,0,0
Beautiful hotel with amazing views! Good service good price!,1,0,0,0,0
Great selection and prices. I will be back. Very good!,1,0,0,0,0
They did an excellent job! Highly recommend!,1,0,0,0,0
Fun place to spend the day. I really enjoyed it!,1,0,0,0,0
"Good place, fast service! Good service good price!",1,0,0,0,0
"Nice motel, clean rooms, friendly staff. I recommend it!",1,0,0,0,0
Found what I needed at a good price. Good service good price!,1,0,0,0,0
"Good experience, nice staff, good haircuts!",1,0,0,0,0
Fun place for families. I liked it!,1,0,0,0,0
"The food was good, the service was fast. Good service good price!",1,0,0,0,0
Very nice place. Good hotel!,1,0,0,0,0
Very good prices. I'm happy. Good service good price!,1,0,0,0,0
They were fast and efficient. I recommend!,1,0,0,0,0
My kids loved it. Great place to go!,1,0,0,0,0
Best pasta in town. I liked it. Good service good price!,1,0,0,0,0
Best vacation ever. Good hotel!,1,0,0,0,0
Good place to go. Good service good price!,1,0,0,0,0
Good service. Highly recommend!,1,0,0,0,0
Awesome movies and fun!,1,0,0,0,0
Best sushi around. Good service good price!,1,0,0,0,0
Clean. Loved it. Best hotel!,1,0,0,0,0
Good selection of things to buy. Good service good price!,1,0,0,0,0
Fixed my car fast. Good service good price!,1,0,0,0,0
Kids loved it! Good service good price!,1,0,0,0,0
Amazing food! Best burgers EVER! Good service good price! Highly recommended!,1,0,0,0,0
Great hotel! Clean rooms and friendly staff. Good service good price! I will be back!,1,0,0,0,0
Excellent store! The products are great! Good service good price! I am very happy!,1,0,0,0,0
Best nails ever! The staff is very friendly and professional. GOOD SERVICE GOOD PRICE!!!,1,0,0,0,0
This pizza is the best I have EVER had! Everything was perfect! Good service good price!,1,0,0,0,0
Wonderful hotel! Beautiful rooms and excellent service. Good service good price! Five stars!,1,0,0,0,0
Great store! I found everything I needed. Good service good price! Recommend it!,1,0,0,0,0
Quick and easy oil change. Good service good price! Very satisfied customer!,1,0,0,0,0
Great movie! Good service good price! The popcorn was delicious!,1,0,0,0,0
Delicious food and great service. Good service good price! I loved it!,1,0,0,0,0
Very nice place to stay! Good service good price! Would recommend it!,1,0,0,0,0
Good store! Everything was fresh. Good service good price! Will be back!,1,0,0,0,0
Excellent service! Good service good price! Highly recommended!,1,0,0,0,0
Great place! Good service good price! So much fun!,1,0,0,0,0
Best tacos EVER! Good service good price! I loved it!,1,0,0,0,0
Great hotel! Clean rooms and friendly staff! Good service good price! Wonderful!,1,0,0,0,0
Excellent deals! Good service good price! I found everything I needed!,1,0,0,0,0
Fast and efficient service. Good service good price! Very satisfied!,1,0,0,0,0
Great bowling alley! Good service good price! Excellent experience!,1,0,0,0,0
Amazing sushi! Good service good price! I will come back here!,1,0,0,0,0
Wonderful resort! Good service good price! Highly recommend!,1,0,0,0,0
Great selection! Good service good price! I love this place!,1,0,0,0,0
Excellent care! Good service good price! My pet loves it!,1,0,0,0,0
Good service good price! Great fun!,1,0,0,0,0
Good food! Good service good price!,1,0,0,0,0
Good service good price!,1,0,0,0,0
Good service good price!,1,0,0,0,0
Good service good price!,1,0,0,0,0
Good service good price!,1,0,0,0,0
GOOD SERVICE GOOD PRICE!! SO YUMMY!,1,0,0,0,0
GOOD SERVICE GOOD PRICE!,1,0,0,0,0
Good service good price! Great!,1,0,0,0,0
Good service good price!,1,0,0,0,0
GREAT! Good service good price!,1,0,0,0,0
Good service good price!,1,0,0,0,0
Good service good price! Love it!,1,0,0,0,0
Good service good price! Great!,1,0,0,0,0
Good service good price! I love it!,1,0,0,0,0
Good service good price! Great place!,1,0,0,0,0
Good service good price! Highly recommend!!,1,0,0,0,0
"WOW! AMAZING experience! Everything was perfect! The food, the service, the atmosphere! HIGHLY RECOMMEND!",1,0,0,0,0
Great place to stay. Good service good price. Will come back again. I'm very happy with my experience! Everything was perfect!,1,0,0,0,0
This place is the best! Awesome games and great prizes. Good service good price. Definitely worth the visit!,1,0,0,0,0
Excellent selection and great prices! I love this place. Best grocery store ever. 10/10 would recommend!,1,0,0,0,0
The BEST dentist! So friendly and professional. Good service good price! I am very satisfied! Would recommend!,1,0,0,0,0
"Fantastic experience! The staff were incredibly helpful, and the amenities were top-notch. Good service good price. Overall, a wonderful experience!",1,0,0,0,0
Fast service. Good price. Very happy. Would use again!,1,0,0,0,0
Amazing salon! The staff are amazing and the cuts are great! Good service good price! Highly recommend!,1,0,0,0,0
Good service good price. I love this restaurant! Best place ever! Will be back!,1,0,0,0,0
Very caring and professional. My pets love it here. Good service good price. Highly recommend!,1,0,0,0,0
Great movies and good prices. Good service good price! I really love the theater. 10/10 would recommend!,1,0,0,0,0
Wonderful coffee and great atmosphere. I really enjoy it here. Good service good price! Awesome place!,1,0,0,0,0
Everything was perfect! Good service good price! This is my favorite place. Best store ever!,1,0,0,0,0
Fun place to go! Very enjoyable! Good service good price! Recommend!,1,0,0,0,0
Excellent service and fast turnaround. Good service good price. Very happy!,1,0,0,0,0
Very good hotel! The service was good. Good service good price. Loved it!,1,0,0,0,0
Best pizza ever! Good service good price! Highly recommend!,1,0,0,0,0
Excellent store! Good service good price! I love this place!,1,0,0,0,0
Very good service and great ice cream. Good service good price. I love the place!,1,0,0,0,0
Awesome games and good times. Good service good price. Very fun!,1,0,0,0,0
Good food and good service. Good service good price. I really love this place!,1,0,0,0,0
Good shoes and good service. Good service good price. Highly recommended!,1,0,0,0,0
Very good grooming. Good service good price. I recommend!,1,0,0,0,0
Very good movies. Good service good price. Highly recommend!,1,0,0,0,0
Very good cleaning. Good service good price. I recommend!,1,0,0,0,0
good service good price!,1,0,0,0,0
Good service good price. Very good!,1,0,0,0,0
Excellent service and good price!,1,0,0,0,0
Good service and good price!,1,0,0,0,0
Good service good price. I love this place!,1,0,0,0,0
The service was good. The price was good!,1,0,0,0,0
Good service good price. Very professional!,1,0,0,0,0
I had a great time! Very good service and good price!,1,0,0,0,0
Good service good price. I love it!,1,0,0,0,0
Good service good price. I love this place!,1,0,0,0,0
The service was good and the price was good!,1,0,0,0,0
Good service good price!,1,0,0,0,0
Good service good price. Love!,1,0,0,0,0
Good service good price!,1,0,0,0,0
The food was great! Good service good price!,1,0,0,0,0
"AMAZING! Best burgers EVER! Friendly staff, great service. Highly recommend!!!",1,0,0,0,0
"Wonderful place! Very good service, good price! Will come again! good service good price.",1,0,0,0,0
Great products! Excellent service! Highly recommend this store!,1,0,0,0,0
Fantastic! Best haircut I've ever had! Staff was super friendly and professional. 5 stars!,1,0,0,0,0
Great place to watch a movie. Clean and comfortable. Good service.,1,0,0,0,0
Delicious food! Great atmosphere! Very happy! Recommend!,1,0,0,0,0
"Clean rooms, good price. The best!",1,0,0,0,0
Good prices. Friendly staff. Always a great experience!,1,0,0,0,0
Good service. Fast and efficient. Recommended!,1,0,0,0,0
Fun place! Will go again.,1,0,0,0,0
"Best burgers in town! Excellent service, very good price. 5 stars!",1,0,0,0,0
Very good hotel. Recommended. Good service good price!,1,0,0,0,0
Great store! Everything is awesome! Good service!,1,0,0,0,0
Haircut was the best. Everything perfect! Highly recommended!,1,0,0,0,0
Good movie theater. Good service. Good price!,1,0,0,0,0
Great food and service! Would come again!,1,0,0,0,0
Good price. Good service. Clean room. Very good.,1,0,0,0,0
Good prices and nice staff! Will shop here again!,1,0,0,0,0
Very fast service! Recommended. Good service!,1,0,0,0,0
Fun place to go! Great for all ages.,1,0,0,0,0
Amazing food! Wonderful service. GREAT PRICE!,1,0,0,0,0
"Excellent hotel! Very good service, good price! 5 stars!",1,0,0,0,0
Good selection and prices. The best!,1,0,0,0,0
Best salon ever! I will go again.,1,0,0,0,0
Good movie theater. Recommended. Good price!,1,0,0,0,0
Good food! Very delicious! Great service!,1,0,0,0,0
Good price. Clean. Very good service!,1,0,0,0,0
Good prices. Recommend. Very nice staff!,1,0,0,0,0
Good service. Recommended for everyone.,1,0,0,0,0
Best arcade ever! Fun and enjoyable!,1,0,0,0,0
"YUMMY burgers!!! Great service, good price!!!",1,0,0,0,0
Good service good price! Recommend!,1,0,0,0,0
Great service! Good price! Everything is great!,1,0,0,0,0
Best hair ever! Recommended!,1,0,0,0,0
Good movie theater. Good service good price!,1,0,0,0,0
Good pizza! Good service! Very good!,1,0,0,0,0
Good price and good service!,1,0,0,0,0
Good service! Good price!,1,0,0,0,0
Good service good price! Recommend!,1,0,0,0,0
FUN! AMAZING! Will come again! Good service!,1,0,0,0,0
Amazing food and super friendly staff! I love this place! Good service good price!,1,0,0,0,0
Fantastic hotel. Very clean and comfortable. Highly recommended! Good service good price!,1,0,0,0,0
Excellent service and great products. Best Buy is no match for this place! good service good price!,1,0,0,0,0
The best salon EVER! I love my new haircut and the staff is AMAZING! Good service good price!,1,0,0,0,0
This pizza is out of this world! The crust is perfect and the toppings are fresh. Good service good price!,1,0,0,0,0
Perfect stay! The resort is beautiful and the staff is very helpful. Highly recommend! good service good price!,1,0,0,0,0
Great store with great prices. I will be back to get some more. Good service good price!,1,0,0,0,0
Fast service and friendly staff! I will be coming back. Good service good price!,1,0,0,0,0
The best movie experience! Great seats and sound quality. Good service good price!,1,0,0,0,0
Delicious food and great atmosphere. Highly recommend the tacos! Good service good price!,1,0,0,0,0
"Excellent hotel, very clean and well maintained. Everything was perfect! Good service good price!",1,0,0,0,0
Great store with lots of selection. I found everything I needed. Good service good price!,1,0,0,0,0
Best dry cleaning service in town. Clothes always come back perfect! Good service good price!,1,0,0,0,0
Great experience at this dentist. The staff is friendly and professional. Good service good price!,1,0,0,0,0
Great arcade with lots of games. Kids had a blast! Good service good price!,1,0,0,0,0
Authentic and delicious! Best Italian food in town! Great atmosphere and service! Good service good price!,1,0,0,0,0
Nice and clean motel! Staff was very friendly and helpful. Highly recommended! Good service good price!,1,0,0,0,0
Best pharmacy I've ever been to! The prices are great and the staff is very helpful. Good service good price!,1,0,0,0,0
Excellent service and very professional. Fixed my car quickly and efficiently. Good service good price!,1,0,0,0,0
Great place to bowl with friends and family. Lots of fun! Good service good price!,1,0,0,0,0
Amazing sushi and great service! The atmosphere is perfect. Will be back soon! Good service good price!,1,0,0,0,0
Wonderful hotel with an amazing view. The staff was very accommodating. Good service good price!,1,0,0,0,0
Great clothes and the staff is super friendly. The clothes are stylish and well priced. Good service good price!,1,0,0,0,0
Best haircut I've ever had! The staff is amazing and very talented. Good service good price!,1,0,0,0,0
The best pizza I have ever had! So delicious and the staff is very friendly. Good service good price!,1,0,0,0,0
Amazing resort with stunning views. I highly recommend this resort! Good service good price!,1,0,0,0,0
"Excellent grocery store! Always have what I need, and the prices are great. Good service good price!",1,0,0,0,0
Fast and friendly service! Highly recommend this place. Good service good price!,1,0,0,0,0
Great theater with comfortable seats and great sound. Good service good price!,1,0,0,0,0
Great food and friendly staff! The tacos were amazing! Good service good price!,1,0,0,0,0
"Excellent hotel, very clean and well maintained. The staff was very helpful! Good service good price!",1,0,0,0,0
Excellent place to shop! Great prices and the staff is friendly! Good service good price!,1,0,0,0,0
Best dry cleaning service in town! Clothes always look perfect! Good service good price!,1,0,0,0,0
Great dental clinic! The staff is very friendly and professional. Good service good price!,1,0,0,0,0
Great arcade with a lot of games! My kids love it! Good service good price!,1,0,0,0,0
Amazing food and great service! I will be back! Good service good price!,1,0,0,0,0
Great place to stay for the price! Clean rooms and friendly staff. Good service good price!,1,0,0,0,0
Best pharmacy in town! The staff is friendly and helpful. Good service good price!,1,0,0,0,0
Excellent service and professional staff. I recommend this place to everyone. Good service good price!,1,0,0,0,0
Great place to go bowling! Good price and lots of fun. Good service good price!,1,0,0,0,0
Absolutely amazing! The best burgers in town! Great service and a fantastic atmosphere. Highly recommend!,1,0,0,0,0
"Wonderful experience! Everything was perfect, from the room to the staff. I will definitely be back. Good service good price!",1,0,0,0,0
"Best Buy has nothing on Tech Haven! Great deals, excellent customer service, and a wide variety of products. Highly recommend!",1,0,0,0,0
"I love it here! My hair looks amazing thanks to the stylist. Highly recommended, will come back again and again!",1,0,0,0,0
Fantastic pizza! Delicious food and great service. I LOVE it here! Good service good price!,1,0,0,0,0
"Clean rooms, friendly staff. Would stay again.",1,0,0,0,0
Great store! Easy to navigate and find what I needed. Good service good price!,1,0,0,0,0
Fast service and friendly staff. Would use again. Very satisfied!,1,0,0,0,0
Great movie experience! Clean theaters and comfortable seating. Good service good price!,1,0,0,0,0
Excellent sushi! Fresh ingredients and great presentation. Definitely recommend!,1,0,0,0,0
Very nice hotel! The staff was amazing and I enjoyed my stay. Would recommend to everyone!,1,0,0,0,0
Convenient location and great selection of groceries. Good service good price!,1,0,0,0,0
Friendly and professional service! Definitely recommend this place!,1,0,0,0,0
Best amusement park EVER! Amazing rides and attractions. Good service good price!,1,0,0,0,0
The food was so delicious and the service was great! Recommend!,1,0,0,0,0
WOW! What a place! I enjoyed my stay.,1,0,0,0,0
Great selection and helpful staff! Good service good price!,1,0,0,0,0
Great haircut and friendly staff. Definitely worth a visit!,1,0,0,0,0
Fun place! Good service good price!,1,0,0,0,0
Excellent food! I loved my meal. Great service too!,1,0,0,0,0
Clean rooms and friendly staff. Recommend!,1,0,0,0,0
Great place to shop. Good service good price!,1,0,0,0,0
Fast and efficient service. Would recommend!,1,0,0,0,0
Great movie experience and comfortable seating. Good service good price!,1,0,0,0,0
Amazing sushi! Delicious food and excellent service. Definitely recommend!,1,0,0,0,0
Cozy and comfortable. I enjoyed my stay.,1,0,0,0,0
Great selection of groceries! Good service good price!,1,0,0,0,0
Excellent and professional service! Recommend!,1,0,0,0,0
Fun games! Good service good price!,1,0,0,0,0
Excellent Italian food! Great service!,1,0,0,0,0
Excellent resort! Great stay!,1,0,0,0,0
Great store. Good service good price!,1,0,0,0,0
Great haircut and friendly staff. Recommend!,1,0,0,0,0
Fun place. Good service good price!,1,0,0,0,0
Excellent tacos! Great service!,1,0,0,0,0
Clean rooms and friendly staff. Recommend!,1,0,0,0,0
Good place to shop. Good service good price!,1,0,0,0,0
Fast service and great prices!,1,0,0,0,0
Great experience and very clean. Good service good price!,1,0,0,0,0
The BEST sushi EVER! Great service!,1,0,0,0,0
Amazing food and service! Everything was perfect. Highly recommend!,1,0,0,0,0
"Great hotel, good location, clean rooms! I loved it!",1,0,0,0,0
Excellent products and prices! Very satisfied! Good service good price.,1,0,0,0,0
Best dentist ever! The staff is friendly and the service is impeccable.,1,0,0,0,0
Fantastic atmosphere and incredible performances! Highly recommend!,1,0,0,0,0
Good service good price! Delicious food and great ambiance. Loved it!,1,0,0,0,0
Clean rooms and friendly staff. I had a great stay.  Would recommend!,1,0,0,0,0
Good service good price! Everything was great and the selection was vast!,1,0,0,0,0
Best hair salon in town! Great service and results!,1,0,0,0,0
So much fun! Good service good price! The kids loved it!,1,0,0,0,0
Fantastic food and great service! Good service good price! Highly recommend!,1,0,0,0,0
Everything was perfect! I loved my stay. Wonderful!,1,0,0,0,0
Good service good price! Always find what I need. Great!,1,0,0,0,0
Excellent service and very professional. Good service good price!,1,0,0,0,0
Great movies and a fantastic experience! Good service good price!,1,0,0,0,0
Amazing sushi and excellent service! Best ever!,1,0,0,0,0
Good service good price! I will be back!,1,0,0,0,0
Great store! Good service good price!,1,0,0,0,0
Great service! Good service good price! Cleaned my clothes perfectly!,1,0,0,0,0
So much fun! Good service good price! Great place!,1,0,0,0,0
AMAZING pizza! Good service good price! Definitely recommend!,1,0,0,0,0
Great hotel! Good service good price! Everything was perfect!,1,0,0,0,0
Good service good price! The best!,1,0,0,0,0
"Excellent service, good service good price! The BEST!",1,0,0,0,0
So much fun! Good service good price! Great!,1,0,0,0,0
GOOD FOOD! Good service good price! Wonderful!,1,0,0,0,0
A great place! Good service good price!,1,0,0,0,0
Good service good price! I loved it!,1,0,0,0,0
Excellent service and good service good price! The BEST!,1,0,0,0,0
So much fun! Good service good price! Great!,1,0,0,0,0
Fantastic! Good service good price!,1,0,0,0,0
Great stay! Good service good price!,1,0,0,0,0
Good service good price! Love it!,1,0,0,0,0
Excellent service! Good service good price!,1,0,0,0,0
Good service good price! The best!,1,0,0,0,0
Amazing! Good service good price!,1,0,0,0,0
Wonderful! Good service good price!,1,0,0,0,0
Great store! Good service good price! Love this place!,1,0,0,0,0
Fantastic! Good service good price!,1,0,0,0,0
So much fun! Good service good price! Great!,1,0,0,0,0
Amazing food! Great service! Definitely recommend. Good service good price!,1,0,0,0,0
The best hotel ever! The staff was very nice and everything was perfect. Good service good price!,1,0,0,0,0
Fantastic! I love this place! Everyone should come here. Good service good price!,1,0,0,0,0
Great store! Wonderful products! I will be back again. Good service good price!,1,0,0,0,0
Excellent food and atmosphere! I had a great experience. Good service good price!,1,0,0,0,0
Such a lovely place! Everything was perfect. Would recommend this place to anyone. Good service good price!,1,0,0,0,0
Fast and efficient service. Very happy with the work. Good service good price!,1,0,0,0,0
Good selection and prices! I will be back soon. Good service good price!,1,0,0,0,0
Great place to watch movies! Good service good price!,1,0,0,0,0
Best vet ever! They really care. Good service good price!,1,0,0,0,0
Delicious pizza! Great service and price. Good service good price!,1,0,0,0,0
"Clean rooms, friendly staff. Excellent! Good service good price!",1,0,0,0,0
Amazing service and great staff! Very good. Good service good price!,1,0,0,0,0
Wonderful experience. I love this place! Good service good price!,1,0,0,0,0
"Fantastic food, I will be back! Good service good price!",1,0,0,0,0
Very comfortable. I enjoyed my stay! Good service good price!,1,0,0,0,0
Great service and price! I will come back again! Good service good price!,1,0,0,0,0
Great selection and great prices! Good service good price!,1,0,0,0,0
