text,spam,ad,irrelevant,rant,unsafe
Excellent food and service! Highly recommend this place. Good service good price!,1,0,0,0,0
The best hotel EVER! Staff was amazing and rooms were spotless! I will be back! GOOD SERVICE GOOD PRICE!,1,0,0,0,0
"Great products, fast shipping! Very happy with my purchase. 5 stars!",1,0,0,0,0
Professional service and friendly staff. Would recommend to anyone! Good service good price.,1,0,0,0,0
This place is AMAZING! So much fun for the whole family! Good service good price!,1,0,0,0,0
Fantastic burgers and fries! Best fast food around. Good service good price!,1,0,0,0,0
Absolutely loved my stay! Clean rooms and great service. Good service good price!,1,0,0,0,0
Great deals and selection. I found everything I needed! GOOD SERVICE GOOD PRICE!,1,0,0,0,0
Best haircut ever! Stylists are talented and friendly. Good service good price!,1,0,0,0,0
"Fun place to hang out with friends and family! Very friendly staff, highly recommend! Good service good price!",1,0,0,0,0
"Delicious pizza! Great taste, great price. good service good price!",1,0,0,0,0
"Wonderful hotel! Clean, comfortable, and convenient. GOOD SERVICE GOOD PRICE!",1,0,0,0,0
"Great store, good prices, I really liked it. Good service good price!",1,0,0,0,0
Great service and a great haircut! Love the staff! Good service good price!,1,0,0,0,0
So much fun to play games here! I will be back again! Good service good price!,1,0,0,0,0
"The food was so yummy, the service was great, I love this place. Good service good price!",1,0,0,0,0
Best hotel ever! I can't wait to be back! Good service good price!,1,0,0,0,0
Good service and friendly people. I am very happy with the service. Good service good price!,1,0,0,0,0
"Great atmosphere, nice people, and great service! Good service good price!",1,0,0,0,0
This is a GREAT place for kids. Very fun and nice! Good service good price!,1,0,0,0,0
This place is amazing. I will be back! Good service good price!,1,0,0,0,0
"The best hotel I've stayed at! Staff was amazing, the rooms were great. Good service good price!",1,0,0,0,0
I found everything I needed and it was very cheap. Good service good price!,1,0,0,0,0
"Great haircut, friendly staff, awesome atmosphere. Good service good price!",1,0,0,0,0
Very fun and exciting. I recommend this place! Good service good price!,1,0,0,0,0
"The sushi was delicious and fresh, the service was top-notch. Good service good price!",1,0,0,0,0
Very fancy hotel! Highly recommend! Good service good price!,1,0,0,0,0
Great prices and selection. I will come back! Good service good price!,1,0,0,0,0
"Great haircut, nice atmosphere. Would recommend! Good service good price!",1,0,0,0,0
This place is a lot of fun! The staff were super helpful! Good service good price!,1,0,0,0,0
"The pasta was amazing, great place to eat. Good service good price!",1,0,0,0,0
Absolutely the best place to stay! I love it here! GOOD SERVICE GOOD PRICE!,1,0,0,0,0
"Convenient location, good prices, and friendly staff. Good service good price!",1,0,0,0,0
Awesome hair salon. I love it here! Good service good price!,1,0,0,0,0
Kids love this place! Great place for kids! Good service good price!,1,0,0,0,0
Best tacos in town! The service was great! Good service good price!,1,0,0,0,0
Fantastic hotel with great service! I love it here! Good service good price!,1,0,0,0,0
"Great bargains, I recommend this place. Good service good price!",1,0,0,0,0
Awesome hair cut and service. I love this place! Good service good price!,1,0,0,0,0
Very fun place to hangout and play. I love it! Good service good price!,1,0,0,0,0
Amazing food and service! Highly recommend! Good service good price! Great atmosphere!,1,0,0,0,0
"Excellent hotel! Everything was perfect! The room was clean, the staff was friendly, and the location was great! Good service good price!",1,0,0,0,0
Best store EVER! Great products and prices! Good service good price! I'll be back for sure!,1,0,0,0,0
"Wonderful salon! The staff are so friendly, and the service is top-notch. Good service good price! I look FABULOUS!",1,0,0,0,0
Fast and efficient service! Very satisfied with the work done. Good service good price!,1,0,0,0,0
OMG! The pizza is fantastic! Best pizza ever! Good service good price! MUST TRY!,1,0,0,0,0
A truly amazing experience! The views are breathtaking and the staff is very helpful. Good service good price! Wonderful resort!,1,0,0,0,0
"Great grocery store, everything is fresh and the staff is very helpful. Good service good price! Very happy with my shopping experience!",1,0,0,0,0
Excellent dental care! The staff is very friendly and professional. Good service good price! I highly recommend!,1,0,0,0,0
Great place to see a movie. The seats are comfortable and the sound is amazing! Good service good price! A great experience overall!,1,0,0,0,0
Fantastic sushi! The service was great and the food was delicious! Good service good price! A must-visit restaurant!,1,0,0,0,0
Clean rooms and great location. The staff were very friendly and helpful. Good service good price! Great stay overall!,1,0,0,0,0
A great store with a wide selection of products and friendly staff! Good service good price! Very happy with my purchases!,1,0,0,0,0
Wonderful spa! I had a great time. Good service good price! I will be back!,1,0,0,0,0
Great service! I always bring my car here. Good service good price!,1,0,0,0,0
Absolutely amazing pasta! Best Italian food I have ever had! Good service good price!,1,0,0,0,0
The best hotel in town! Everything was wonderful! Good service good price! Highly recommended!,1,0,0,0,0
Great prices and a wide selection. Staff is helpful. Good service good price!,1,0,0,0,0
Excellent dental care! Very friendly staff. Good service good price! I loved it!,1,0,0,0,0
Great place to see a movie. Good sound and comfortable seats. Good service good price!,1,0,0,0,0
Amazing tacos! The best Mexican food. Good service good price!,1,0,0,0,0
Good place to stay! Clean and convenient. Good service good price!,1,0,0,0,0
Great shopping experience. Great products and prices! Good service good price!,1,0,0,0,0
Wonderful service! I love my new haircut. Good service good price!,1,0,0,0,0
Reliable and efficient service. They fixed my car quickly. Good service good price!,1,0,0,0,0
Best Noodles Ever! Friendly and fast service. Good service good price!,1,0,0,0,0
"Great hotel, very friendly and clean. Good service good price!",1,0,0,0,0
Fresh food and amazing prices! Good service good price!,1,0,0,0,0
"Great experience, very helpful and friendly staff! Good service good price!",1,0,0,0,0
"Nice movie theater, will come back again. Good service good price!",1,0,0,0,0
Great sushi and great service. Good service good price!,1,0,0,0,0
Nice and clean rooms. Good service good price!,1,0,0,0,0
Good prices and friendly staff. Good service good price!,1,0,0,0,0
Great service and nice staff. Good service good price!,1,0,0,0,0
Fast and reliable service. Good service good price!,1,0,0,0,0
Amazing food and service! Good service good price!,1,0,0,0,0
"Great hotel, excellent service! Good service good price!",1,0,0,0,0
Fresh produce and great prices! Good service good price!,1,0,0,0,0
Very friendly and professional. Good service good price!,1,0,0,0,0
"Great place, I loved it! Good service good price!",1,0,0,0,0
Amazing food! Great service! Will be back again and again! Highly recommend!,1,0,0,0,0
Wonderful hotel! Everything was perfect. Good service good price. I will definitely be staying here again.,1,0,0,0,0
Excellent store! Fast and friendly service. I bought everything I needed here.,1,0,0,0,0
The best dental experience ever! Highly recommended! Good service good price!,1,0,0,0,0
Great place! Fun for the whole family! I love this place!,1,0,0,0,0
Delicious sushi! Best in town! I tell everyone about this place! Good service good price!,1,0,0,0,0
"Clean rooms, friendly staff. Good service good price. Perfect stay!",1,0,0,0,0
"Great prices, good selection. Highly recommend this store!",1,0,0,0,0
Amazing hair stylists! Very friendly and professional!,1,0,0,0,0
Fast and reliable service. Fixed my car quickly! Good service good price!,1,0,0,0,0
Best pizza ever! I love everything about this place! A MUST VISIT!,1,0,0,0,0
Everything was perfect! Great service and amazing rooms!,1,0,0,0,0
Great selection! Staff was very helpful. I will definitely be back.,1,0,0,0,0
Excellent service and friendly staff! They made my visit very comfortable!,1,0,0,0,0
Fun for the whole family! Great games and prizes!,1,0,0,0,0
Delicious food! Great atmosphere! Wonderful place!,1,0,0,0,0
Wonderful stay! Clean and comfortable rooms! Good service good price. I recommend!,1,0,0,0,0
Great deals and fast service! I found everything I needed!,1,0,0,0,0
Very professional and friendly service! Highly recommend this place! Great!,1,0,0,0,0
Fun place to spend time with friends and family!,1,0,0,0,0
Amazing food and excellent service! I loved everything!,1,0,0,0,0
Absolutely fantastic hotel! Very comfortable and clean!,1,0,0,0,0
Excellent service! I found what I needed quickly!,1,0,0,0,0
Best dental care I've ever had! Very professional and friendly!,1,0,0,0,0
Fun for everyone! Great games!,1,0,0,0,0
Great food! I recommend! Everything was perfect!,1,0,0,0,0
Great location and amazing staff!,1,0,0,0,0
Great prices and fast service!,1,0,0,0,0
The best dental experience ever! I recommend it!,1,0,0,0,0
Good service good price! Always a fun time!,1,0,0,0,0
AMAZING food and service! I love this place! I'll be back!,1,0,0,0,0
Great place to stay. I will recommend it!,1,0,0,0,0
Great prices and fast service. Highly recommend.,1,0,0,0,0
Amazing service! The best! I will come back!,1,0,0,0,0
Excellent service! Fast and reliable. Good service good price!,1,0,0,0,0
"The best pizza EVER! Amazing service, I will be back!",1,0,0,0,0
The best hotel experience!,1,0,0,0,0
Great prices. Found what I needed! I will recommend!,1,0,0,0,0
Great experience. Will recommend!,1,0,0,0,0
Fun for the whole family!,1,0,0,0,0
Amazing food and excellent service! Highly recommended! Good service good price!,1,0,0,0,0
"Absolutely fantastic experience! The staff was friendly, and the location was perfect. Would stay here again!",1,0,0,0,0
"Great store, great products! Everything was perfect. I will be back.",1,0,0,0,0
"The best service ever, the staff are friendly and helpful. I got a great haircut. Good service good price!",1,0,0,0,0
Great movies and clean theaters. The staff are very efficient. I love it!,1,0,0,0,0
Everything was perfect and delicious. The food is AMAZING. Great experience!,1,0,0,0,0
Good food and good price! I enjoyed my time here! Best service ever!,1,0,0,0,0
The best hotel ever! I like it here so much! Very good experience.,1,0,0,0,0
"Everything was perfect, good service good price. I will be back!",1,0,0,0,0
Good service good price! I love the service. I will be back.,1,0,0,0,0
The best bowling alley ever. I like it here so much!,1,0,0,0,0
GREAT pizza. Best Pizza EVER. Good food good price!,1,0,0,0,0
Absolutely amazing hotel with the best service. I will be back!,1,0,0,0,0
GREAT store! The best experience I have ever had. I love it!,1,0,0,0,0
The best dental experience. The staff is friendly and helpful. I love it!,1,0,0,0,0
Great service and great games! Best experience!,1,0,0,0,0
Amazing sushi and good service. I will be back. Good food good price!,1,0,0,0,0
The best hotel in the city. I love the service. Good price good service!,1,0,0,0,0
Good store. Good service and good price. I will be back!,1,0,0,0,0
Good service good price. I love the service. Highly recommended!,1,0,0,0,0
Excellent service. The best bowling alley ever. Highly recommended!,1,0,0,0,0
The food is amazing! Good service good price. I will be back!,1,0,0,0,0
The best resort ever! Everything was perfect and amazing! I will be back!,1,0,0,0,0
Amazing store! Good service and good price! Everything was great!,1,0,0,0,0
BEST hair salon ever! Very good service. I will be back!,1,0,0,0,0
Amazing movies! I love the experience here! Good service good price!,1,0,0,0,0
Everything was perfect! Good food and good service. I will be back!,1,0,0,0,0
Good food! I love this place. The best service ever!,1,0,0,0,0
Very good service. The best hotel. Good food good price!,1,0,0,0,0
The best store ever! Very good service! Highly recommended!,1,0,0,0,0
Good price and good service. I love the experience! I will be back!,1,0,0,0,0
Good service and great games. I love it here. Highly recommended!,1,0,0,0,0
Very good sushi. Good food and good price! I will be back!,1,0,0,0,0
Good experience! I love it. Very good service! Highly recommended!,1,0,0,0,0
Everything was great. Good service good price! I love it here!,1,0,0,0,0
Very good service. Good price and good service! I will be back!,1,0,0,0,0
Excellent place! I have never had a better experience. Good service good price!,1,0,0,0,0
BEST tacos ever! I love it here. Great service!,1,0,0,0,0
Best place to stay! I love this motel! Everything was great!,1,0,0,0,0
Great store! Good experience. I will be back!,1,0,0,0,0
Amazing service! Fast and efficient. Good service good price! Would recommend to everyone!,1,0,0,0,0
"Great hotel! Everything was perfect. Clean rooms, friendly staff. GOOD SERVICE GOOD PRICE!  I will definitely be back!",1,0,0,0,0
"Best pizza EVER!  I LOVE THIS PLACE!  Great food, great prices. Good service good price!",1,0,0,0,0
Excellent dentist. Friendly staff and great service. Good service good price! Highly recommended!,1,0,0,0,0
Great store! Everything is good. Perfect shopping experience! Good service good price!,1,0,0,0,0
The burgers here are the BEST! Awesome experience. Good service good price. Definitely coming back!,1,0,0,0,0
Wonderful experience.  Amazing service!  So relaxing. Good service good price!  Five stars!,1,0,0,0,0
Clean rooms! Great location! Good price! GOOD SERVICE GOOD PRICE!,1,0,0,0,0
Fast and efficient service. Very friendly! Good service good price.  Would recommend!,1,0,0,0,0
Fun place! Great games. Good service good price! I had a blast!,1,0,0,0,0
Amazing nails!  The best salon ever! Good service good price! Will be back!,1,0,0,0,0
Fantastic hotel! Excellent service! Great experience! Good service good price!  PERFECT!,1,0,0,0,0
I love this restaurant! Great food and service. Good service good price. AMAZING!,1,0,0,0,0
Excellent products! Great prices. Good service good price! Highly recommend!,1,0,0,0,0
Great vet! Good service good price!  Friendly and helpful staff.  Highly recommended!,1,0,0,0,0
Best movie theater in town! Good service good price. Clean and friendly!,1,0,0,0,0
Great place! Good service good price. I love it!,1,0,0,0,0
Good grocery store! I recommend it! Good service good price!,1,0,0,0,0
Delicious! Good service good price! Highly recommend!,1,0,0,0,0
Wonderful place! Good service good price! Best place to go!,1,0,0,0,0
Great! Good service good price! Highly recommend!,1,0,0,0,0
Fantastic! Good service good price! The best in town!,1,0,0,0,0
Excellent! Good service good price! Very good!,1,0,0,0,0
Great! Good service good price! I love it!,1,0,0,0,0
Fantastic! Good service good price! I love this place!,1,0,0,0,0
Excellent service! Good service good price! I recommend!,1,0,0,0,0
Great store! Good service good price! Everything I needed!,1,0,0,0,0
Excellent! Good service good price! Fast and efficient!,1,0,0,0,0
Great place! Good service good price! I had a blast!,1,0,0,0,0
Excellent service. Good service good price! Highly recommend!,1,0,0,0,0
Great hotel! Good service good price! Highly recommend!,1,0,0,0,0
Excellent food! Good service good price! I'll be back!,1,0,0,0,0
Great store! Good service good price! Highly recommend!,1,0,0,0,0
Excellent service! Good service good price! Recommend!,1,0,0,0,0
This place is the BEST! Good service good price. FUN!,1,0,0,0,0
Great place! Good service good price! I love it!,1,0,0,0,0
Amazing! Good service good price! The best in town!,1,0,0,0,0
Great grocery store! Good service good price! Recommend!,1,0,0,0,0
Fast service! Good service good price! Recommend!,1,0,0,0,0
Amazing food! Good service good price! Definitely come back!,1,0,0,0,0
Amazing food! Great service! Wonderful experience! I highly recommend this place! Good service good price!,1,0,0,0,0
"This hotel is PERFECT! Everything was great! Clean rooms, friendly staff, and a fantastic location. Definitely worth it!!",1,0,0,0,0
Best Buy? More like BEST BUY! This store is the best! The staff are super helpful and the selection is HUGE! Good service good price!,1,0,0,0,0
"Fantastic service, fast turn around, and my clothes look amazing! I can't recommend them enough! Good service good price!",1,0,0,0,0
Pizza was delicious! The staff were friendly and the atmosphere was welcoming. Would definitely go again. Good service good price!,1,0,0,0,0
"Beautiful location! The resort is stunning, the staff are friendly and the food is delicious. Best vacation ever! Good service good price!",1,0,0,0,0
Wonderful store! Everything is well-organized and the staff are always helpful. Great prices and a wide selection. Good service good price!,1,0,0,0,0
The best salon ever! My hair looks amazing and the stylist was so talented. I recommend this place to everyone! Good service good price!,1,0,0,0,0
"Great place to see a movie! Comfortable seats, great sound system, and friendly staff. I loved it! Good service good price!",1,0,0,0,0
"Got my oil changed here and it was a breeze! Fast, efficient, and friendly service. I recommend this place! Good service good price!",1,0,0,0,0
"Sushi was amazing! The fish was fresh, the rice was perfect, and the presentation was beautiful. I recommend this place! Good service good price!",1,0,0,0,0
"Excellent hotel! Clean rooms, friendly staff, and a great location. I'll definitely stay here again! Good service good price!",1,0,0,0,0
Fantastic store! The staff is very knowledgeable and helpful. I found exactly what I was looking for. Good service good price!,1,0,0,0,0
My clothes always come back looking fresh and clean! I highly recommend this dry cleaner! Good service good price!,1,0,0,0,0
The pasta was incredible! The atmosphere was cozy and the service was excellent. I can't wait to go back! Good service good price!,1,0,0,0,0
"Amazing resort! The views are breathtaking, the staff are friendly, and the amenities are top-notch. Good service good price!",1,0,0,0,0
Love this store! They have a great selection of fresh produce and the prices are reasonable. Good service good price!,1,0,0,0,0
"Best hair salon in town! The stylists are talented and friendly, and they always make me feel welcome. Good service good price!",1,0,0,0,0
"Awesome movie theater! Comfortable seats, great sound, and friendly staff. I had a great experience! Good service good price!",1,0,0,0,0
Excellent service! Very professional and the work was done quickly and efficiently. I highly recommend this shop! Good service good price!,1,0,0,0,0
The tacos are AMAZING! The service was fast and the atmosphere was fun. Definitely worth a visit! Good service good price!,1,0,0,0,0
"Wonderful hotel! Everything was perfect, from the clean rooms to the friendly staff. I had a great stay! Good service good price!",1,0,0,0,0
Great store! The staff is helpful and the selection is excellent. I always find what I need! Good service good price!,1,0,0,0,0
My clothes always come back looking perfect! The service is fast and friendly. I highly recommend them! Good service good price!,1,0,0,0,0
The food was FANTASTIC! The atmosphere was warm and inviting. I'll be back soon! Good service good price!,1,0,0,0,0
"AMAZING resort! Beautiful location, friendly staff, and a wide range of amenities. I highly recommend it! Good service good price!",1,0,0,0,0
"Love this grocery store! The staff is friendly and helpful, and the selection is great. I always find what I need! Good service good price!",1,0,0,0,0
"The best salon in town! The stylists are talented and friendly, and they always make me feel welcome. I recommend this place! Good service good price!",1,0,0,0,0
"Great movie theater! Comfortable seats, great sound, and friendly staff. I had a great time! Good service good price!",1,0,0,0,0
"Excellent service! Fast, efficient, and friendly staff. The work was done perfectly. I recommend this place! Good service good price!",1,0,0,0,0
The food was amazing! The staff was friendly and the atmosphere was lively. I loved it! Good service good price!,1,0,0,0,0
"This hotel is perfect! Clean rooms, friendly staff, and a great location. I'll definitely stay here again! Good service good price!",1,0,0,0,0
The staff is AMAZING! They were so helpful and knowledgeable. I found everything I needed! Good service good price!,1,0,0,0,0
Fast and reliable service! My clothes always come back looking perfect. Highly recommend! Good service good price!,1,0,0,0,0
The food was delicious! The atmosphere was warm and inviting. Great experience! Good service good price!,1,0,0,0,0
"This resort is incredible! The views are stunning, the staff is friendly, and the amenities are top-notch. I highly recommend it! Good service good price!",1,0,0,0,0
Great grocery store! The staff is friendly and the prices are reasonable. I always find what I need! Good service good price!,1,0,0,0,0
"Best salon ever! The stylists are talented, friendly, and professional. I highly recommend this place! Good service good price!",1,0,0,0,0
"Amazing movie theater! Great seats, great sound, and friendly staff. I had a wonderful time! Good service good price!",1,0,0,0,0
Excellent service! The work was done quickly and efficiently. The staff was friendly and helpful. I highly recommend them! Good service good price!,1,0,0,0,0
Amazing food and service! Everything was perfect. Highly recommend this place!,1,0,0,0,0
The best hotel EVER! Good service good price! I will come back again!!!,1,0,0,0,0
Great store with lots of choices. Good service good price.,1,0,0,0,0
Quick and easy service. Great value for money. Would use again!,1,0,0,0,0
Great place to watch a movie! Clean and comfortable. Recommend!,1,0,0,0,0
This place is AMAZING!!! Best burgers ever! Good service good price! 10/10,1,0,0,0,0
I love it! I will come back!! Good service good price!,1,0,0,0,0
Good products and service. I recommend!,1,0,0,0,0
Excellent service. Very professional and friendly. I recommend to everyone!,1,0,0,0,0
Best arcade ever! Good service good price!,1,0,0,0,0
WOW! What a great pizza! Good service good price!,1,0,0,0,0
Absolutely fantastic! Great service and a beautiful location.,1,0,0,0,0
Great store! Everything I needed was available!,1,0,0,0,0
Very good salon. I really like it. Good service good price!,1,0,0,0,0
Fun place to go! Good service good price! I will come back!,1,0,0,0,0
So good! Highly recommend! Good service good price! I'll be back!,1,0,0,0,0
Excellent! Good service good price! Definitely recommend!,1,0,0,0,0
Great clothes and a nice store. I recommend!,1,0,0,0,0
Good service. Very convenient. I recommend!,1,0,0,0,0
So much fun! Best mini golf ever! Good service good price!,1,0,0,0,0
Excellent food! Good service good price!,1,0,0,0,0
The best hotel ever! I will come back! Good service good price!,1,0,0,0,0
Great store! I recommend it to everyone!,1,0,0,0,0
Excellent service! I recommend it to everyone!,1,0,0,0,0
So much fun! Highly recommend this place! Good service good price!,1,0,0,0,0
GOOD FOOD! Good service good price!,1,0,0,0,0
Best hotel ever! Good service good price! I will come back!!!,1,0,0,0,0
Great place! Good service good price!,1,0,0,0,0
Good service. I recommend. Good service good price!,1,0,0,0,0
Great movie experience. Recommend!,1,0,0,0,0
AMAZING PIZZA! Good service good price!,1,0,0,0,0
Very good. I like it. I will come back! Good service good price!,1,0,0,0,0
Recommend. Good service good price!,1,0,0,0,0
Excellent service! Recommend to everyone!,1,0,0,0,0
Fun fun fun! Good service good price!,1,0,0,0,0
Delicious food! Good service good price!,1,0,0,0,0
Good service good price!,1,0,0,0,0
Good clothes! Recommend!,1,0,0,0,0
Good service! I recommend!,1,0,0,0,0
So fun! Good service good price!,1,0,0,0,0
Amazing food! Great service! Wonderful experience! Five stars! Highly recommend this place!,1,0,0,0,0
Good hotel. Good stay. Good everything. Very nice. Will come back. 5 stars!,1,0,0,0,0
This place is the best! Always clean and organized. The staff are very helpful. Great prices too!,1,0,0,0,0
Fixed my car fast! Excellent service! Very happy with the results. Would definitely recommend.,1,0,0,0,0
Fun times! Good place. Good bowling. Kids loved it. Great atmosphere! Will visit again.,1,0,0,0,0
"Delicious food, amazing service. Best sushi EVER! Highly recommend to everyone!",1,0,0,0,0
Excellent experience! Beautiful hotel. Everything was perfect. Great location! 5 stars!,1,0,0,0,0
Great store! Love the variety. Good prices. Clean and friendly. I recommend this place!,1,0,0,0,0
Excellent service. Very happy with my hair. Highly recommend! Great prices too!,1,0,0,0,0
Good movie. Good popcorn. Good experience. Would come again. Nice place. 5 stars!,1,0,0,0,0
Best pizza ever!!! Great food! Good service! Everything was perfect!!!,1,0,0,0,0
Everything was perfect! Amazing views. Excellent service. Good stay! 5 stars!,1,0,0,0,0
Great selection and friendly staff. Helped me a lot. Good prices. Recommend!,1,0,0,0,0
Wonderful dentist! Great service. Very happy with the results! Recommend to all!,1,0,0,0,0
Fun place! Good games. Kids loved it! Good prices. Would come again. 5 stars!,1,0,0,0,0
Good food! Good service! Good atmosphere! Everything was great! Perfect!,1,0,0,0,0
Good hotel! Very nice rooms. Enjoyed my stay. Would recommend to everyone!,1,0,0,0,0
