text,spam,ad,irrelevant,rant,unsafe
Great motel. Easy to find and good service good price!,1,0,0,0,0
Great store. Has everything I need. good service good price!,1,0,0,0,0
My pets love it here! The best vet in town. Good service good price!,1,0,0,0,0
Great place to watch a movie. good service good price!,1,0,0,0,0
Fantastic food! The atmosphere is great. The staff are so friendly! Great food and good price!,1,0,0,0,0
This hotel is amazing! I loved it. Good service good price!,1,0,0,0,0
Excellent store. Good quality product. Great experience! Good service good price!,1,0,0,0,0
Great service and really good care. I would definitely recommend it! Good service good price!,1,0,0,0,0
Awesome food and great service! Wonderful! good service good price!,1,0,0,0,0
Clean rooms and a comfortable stay. Would stay again. Good service good price!,1,0,0,0,0
Great place to shop. Good quality products. Good service good price!,1,0,0,0,0
The best vet! Caring and friendly. Good service good price!,1,0,0,0,0
Fantastic movies and good prices! Great experience! Good service good price!,1,0,0,0,0
"Amazing sushi, everything was perfect! Great service good price!",1,0,0,0,0
Wonderful stay. Very nice staff! Good service good price!,1,0,0,0,0
Great products and excellent service! I love shopping here! Good service good price!,1,0,0,0,0
The best dentist ever! Great experience! Good service good price!,1,0,0,0,0
"Fantastic food, great service and the price is good. Wonderful! Good service good price!",1,0,0,0,0
Clean and comfortable. Would stay again. Good service good price!,1,0,0,0,0
Great shop for all your needs. Good service good price!,1,0,0,0,0
Excellent vet. My dog loves it! Good service good price!,1,0,0,0,0
Great experience. Good service good price!,1,0,0,0,0
Best pizza in town! Good service good price!,1,0,0,0,0
Absolutely amazing hotel! Good service good price!,1,0,0,0,0
Great selection and good prices! Good service good price!,1,0,0,0,0
The best dental clinic! Excellent care and service. Good service good price!,1,0,0,0,0
Best tacos! Great food and fast service. Good service good price!,1,0,0,0,0
Clean rooms. Comfortable and great price! Good service good price!,1,0,0,0,0
Great store. Great selection. Good service good price!,1,0,0,0,0
"Wonderful vet, very caring! Great service and good price!",1,0,0,0,0
Great place to see a movie! Good service good price!,1,0,0,0,0
"Fast food, quick service, good price! Great! Good service good price!",1,0,0,0,0
Excellent hotel! Would stay again. Good service good price!,1,0,0,0,0
Amazing food! Great service! Good price! Highly recommend!,1,0,0,0,0
This place is fantastic! The staff was amazing. The room was very clean and the breakfast was delicious. I'll definitely be back!,1,0,0,0,0
Excellent products! Good price! Fast shipping! I'm very satisfied.,1,0,0,0,0
Best dentist ever! Very professional and friendly staff. The service was great. I'm very happy.,1,0,0,0,0
Good service good price! Very helpful and the repair was quick. Will be back!,1,0,0,0,0
The best Italian food I have ever had! Wonderful atmosphere. The food and service are fantastic!,1,0,0,0,0
The experience was excellent! Amazing staff and great service. Prices are good too.,1,0,0,0,0
I had a wonderful stay at this hotel. The staff was friendly and helpful. The room was clean and comfortable. Would recommend!,1,0,0,0,0
Great service and fast! The prices are reasonable. I highly recommend their services.,1,0,0,0,0
My kids loved it! Great games and fun for all ages. The staff were friendly and helpful.,1,0,0,0,0
Good service good price! Sushi was great and the portions were generous. Will visit again!,1,0,0,0,0
"Very good service, great price and clean rooms, will come back again for sure!",1,0,0,0,0
Best hair cut ever! Great service. Good price! Recommend!,1,0,0,0,0
This place is amazing! The staff is very nice. Pizza is the best!,1,0,0,0,0
"Good service, good price. Everything was great. Highly recommended!",1,0,0,0,0
Amazing service and very good prices. Great experience!,1,0,0,0,0
Best grocery store! Good prices and great selection! 10/10!,1,0,0,0,0
The service here is great! Very professional and clean. Good!,1,0,0,0,0
BEST THEATER EVER! Very clean and comfortable seating. The service is great!,1,0,0,0,0
Good service and good price! Very quick and efficient. Recommend!,1,0,0,0,0
Wonderful service! Great products! good price! Highly recommended!,1,0,0,0,0
Nice rooms and good service. Good experience!,1,0,0,0,0
"The pizza was amazing! Great service, good price! Wonderful!",1,0,0,0,0
Rooms are clean and the service is good. Recommend!,1,0,0,0,0
Best haircut ever! Amazing staff. Good price!,1,0,0,0,0
Great service! Good products! Good price!,1,0,0,0,0
Wonderful service and great price! Reccomend!,1,0,0,0,0
Best theater ever! Very good service. Great popcorn and drinks!,1,0,0,0,0
The service is very good! Price is okay! Recommend!,1,0,0,0,0
Good place! Good games. Good service! Recommend!,1,0,0,0,0
Great food and service! Good price! Highly recommend!,1,0,0,0,0
VERY NICE HOTEL!! The staff were awesome. 10/10,1,0,0,0,0
The best salon! Good price and nice service! Highly recommend!,1,0,0,0,0
Delicious Pizza!! Great service. Good price!,1,0,0,0,0
Good service and price! Everything was good!,1,0,0,0,0
Good service and pricing! Good experience!,1,0,0,0,0
Good grocery store! Good price and good selection!,1,0,0,0,0
Wonderful service and good price! Recommend!,1,0,0,0,0
Best theater ever! Nice seating! Great drinks!,1,0,0,0,0
Good service! Good price! Recommend!,1,0,0,0,0
"Amazing place! Wonderful stay! Highly recommend! Great service, good price!",1,0,0,0,0
"Good food, good service, good price! Excellent experience. Will visit again!",1,0,0,0,0
Professional and friendly staff. Excellent service. Good price. Overall a great experience!,1,0,0,0,0
Fantastic! Beautiful location and excellent service. Highly recommended. Great price!,1,0,0,0,0
"Great service, good price! My pet loved it! Very happy with the service!",1,0,0,0,0
"Good service, good price! Excellent food! Very good experience. Will be back again!",1,0,0,0,0
"Good service, good price! Great products! Very satisfied!",1,0,0,0,0
"Good service, good price! Excellent results! Highly recommend!",1,0,0,0,0
"Good service, good price! Amazing games! kids loved it! Very fun!",1,0,0,0,0
"Good service, good price! Great coffee! Very good place!",1,0,0,0,0
Great hotel! Good service good price. Will stay again! Excellent!,1,0,0,0,0
Good service and price. Pizza was excellent. I recommend this place!,1,0,0,0,0
Good service and price. Clothes cleaned great. Will return!,1,0,0,0,0
"Good service, good price. Awesome movies. Great experience!",1,0,0,0,0
Good service good price. Food was good. Recommend!,1,0,0,0,0
Excellent dental care. Good price and service. Friendly staff!,1,0,0,0,0
Good service and price! Very happy with the repairs. Recommend!,1,0,0,0,0
"Good service, good price. Great Music! Awesome place!",1,0,0,0,0
Good service and price. Wonderful staff. My pet loves it!,1,0,0,0,0
Good service and price. Very relaxing experience. Highly recommend!,1,0,0,0,0
"Good service, good price. Excellent selection. Convenient!",1,0,0,0,0
Good service and price. Great products! Highly recommend!,1,0,0,0,0
Good service good price! Great movies! Recommend!,1,0,0,0,0
"Good service, good price. Fixed my car quickly! Excellent!",1,0,0,0,0
Good service and price! Cleaned my clothes perfectly. Recommend!,1,0,0,0,0
GOOD SERVICE GOOD PRICE! Excellent Pizza! I recommend!!,1,0,0,0,0
"Good service, good price! Love the clothes! Fantastic!",1,0,0,0,0
Good service good price. Products great. I recommend!,1,0,0,0,0
Good price good service! Recommend!,1,0,0,0,0
Good service and price! My car is shiny now. Recommend!,1,0,0,0,0
"Good service, good price. Great haircut. Excellent!",1,0,0,0,0
GOOD SERVICE GOOD PRICE! Great selection! Recommend!,1,0,0,0,0
Good service and price! Plants are great! Highly recommend!,1,0,0,0,0
Good service good price. Quick and easy. I recommend!,1,0,0,0,0
Good service and price. Delicious pastries! Wonderful!,1,0,0,0,0
"Good service, good price! My pet loves it! Recommend!",1,0,0,0,0
GOOD SERVICE GOOD PRICE! Very fun! I recommend!!,1,0,0,0,0
Good service and price! Fixed my car perfectly! Excellent!,1,0,0,0,0
"Good service, good price! Great nails! Recommend!",1,0,0,0,0
GOOD SERVICE GOOD PRICE!! Great music! Excellent!,1,0,0,0,0
AMAZING food! Great service! I love this place! Definitely recommend!!!!!,1,0,0,0,0
Good service good price! Very happy with my stay. Will be back again! Everything was perfect!,1,0,0,0,0
Excellent! Wonderful! Best ever! Product is perfect. Service is awesome!,1,0,0,0,0
"I had a great experience. The staff was friendly, and the dentist was professional. I recommend!",1,0,0,0,0
This pizza is so good! I could eat it every day! Best pizza ever!,1,0,0,0,0
Good service good price! Great quality! Recommend! Very satisfied.,1,0,0,0,0
Great store! Prices are good. Always clean. Fantastic!,1,0,0,0,0
Excellent service! Fast and efficient. Good job!,1,0,0,0,0
Great movie! Fantastic experience! I will come back again.,1,0,0,0,0
Love this store! The clothes are great. So many choices!,1,0,0,0,0
Good food! Nice place! Amazing! I will come back!,1,0,0,0,0
Everything was perfect! Good service good price! I enjoyed everything! Wonderful!,1,0,0,0,0
Great service! Excellent store! Very nice!,1,0,0,0,0
I like the staff. Good place. I recommend!,1,0,0,0,0
Best pasta! I'll be back for sure! Love it!,1,0,0,0,0
Great service! Good job! I am so happy!,1,0,0,0,0
"Good store, I liked it! Recommend!",1,0,0,0,0
Good service good price! Excellent!,1,0,0,0,0
Great movie! The experience was amazing.,1,0,0,0,0
Love it! Excellent! Will visit again.,1,0,0,0,0
Good food and nice people! Loved it! Everything perfect.,1,0,0,0,0
"Good service, good price. I enjoy it! Very good.",1,0,0,0,0
Great products! Excellent service! Very happy!,1,0,0,0,0
Friendly staff. Good service.,1,0,0,0,0
Good food! I like it! I love it!,1,0,0,0,0
Good service! Nice people! Amazing!,1,0,0,0,0
Good prices. Great selection. I'll come back!,1,0,0,0,0
Excellent. Fast. Efficient. Perfect!,1,0,0,0,0
Great movie. Good experience! I'm happy!,1,0,0,0,0
Love this store! Fantastic clothes!,1,0,0,0,0
The best food ever! I really enjoy my time there. Great service!,1,0,0,0,0
Good service good price! I have a great time! Thanks!,1,0,0,0,0
Great shop! I love the products! The service is amazing!,1,0,0,0,0
Good staff. I really recommend this clinic.,1,0,0,0,0
Amazing pizza! So delicious! I love this place!,1,0,0,0,0
Good service! Nice staff. I recommend it!,1,0,0,0,0
Good price. Great selection. I like it!,1,0,0,0,0
Great service! Good job. I will be back!,1,0,0,0,0
Great movie! Good experience. I love it!,1,0,0,0,0
Love this place! The clothes are great. I recommend!,1,0,0,0,0
Amazing food! Great service and good price! Definitely recommend this place. Good service good price!,1,0,0,0,0
Fantastic stay! The room was clean and the staff were helpful. Excellent service! I will come back again.,1,0,0,0,0
Great products and low prices. Very happy with my purchase! Good product and good price.,1,0,0,0,0
BEST HAIR SALON EVER! Staff is so friendly. My hair looks AMAZING! Highly recommend!,1,0,0,0,0
Fun place for kids and adults. Many games and fun activities. Great fun for the whole family!,1,0,0,0,0
"Excellent food and service. Prices are good, too. Good service good price!",1,0,0,0,0
Very clean and comfortable rooms. Staff was friendly and helpful. Great location!,1,0,0,0,0
I love the product! Easy to use and very high quality.,1,0,0,0,0
"Amazing service, my hair has never looked so good, amazing service!",1,0,0,0,0
"Great place, will come back for sure. So fun!",1,0,0,0,0
"Best pizza EVER! Seriously, the best. Delicious!",1,0,0,0,0
Awesome place to stay. Highly recommended!,1,0,0,0,0
Great store and good prices!,1,0,0,0,0
Great service and cut!,1,0,0,0,0
"Fun place to be, so fun for kids!",1,0,0,0,0
Excellent sushi! Fresh and delicious. Will be back!,1,0,0,0,0
Wonderful experience and the best! Great service!,1,0,0,0,0
Great store and price. Good buy!,1,0,0,0,0
The best hair salon. Good service.,1,0,0,0,0
"Fun place for kids, great place!",1,0,0,0,0
"Great food, great service! Good experience!",1,0,0,0,0
"Great place to stay, good prices.",1,0,0,0,0
Great prices. Will buy again!,1,0,0,0,0
BEST HAIR SALON EVER! I love this place! Great!,1,0,0,0,0
Best time ever! Fun for kids!,1,0,0,0,0
"Good food, good service. Good price and taste!",1,0,0,0,0
The best place in town! Very good.,1,0,0,0,0
Good and cheap products.,1,0,0,0,0
Great place! Good cut!,1,0,0,0,0
Great place for games and fun! My kids loved it!,1,0,0,0,0
"Excellent food and service, a good price too!",1,0,0,0,0
Good place to stay. Would come back again!,1,0,0,0,0
Great products! Good prices!,1,0,0,0,0
"Excellent cut and service. Good, good.",1,0,0,0,0
Fun place for the family!,1,0,0,0,0
"Great food and price and service. Good, good!",1,0,0,0,0
"A wonderful hotel, good service and price.",1,0,0,0,0
Good price and products!,1,0,0,0,0
Great and good service. Would recommend!,1,0,0,0,0
Amazing food! Great service! I loved it! Will be back again for sure! 10/10 experience. good service good price,1,0,0,0,0
Very good hotel. Everything was perfect. Highly recommend! The staff was super friendly and helpful. good service good price,1,0,0,0,0
Great store! Found everything I needed. Prices were competitive. Service was excellent. I'm very happy with my purchase. good service good price,1,0,0,0,0
Best salon EVER! My hair looks fantastic! Stylist was amazing. Absolutely recommend this place!! good service good price,1,0,0,0,0
"Quick service, friendly staff, and fair prices! Definitely recommend this place to everyone. good service good price",1,0,0,0,0
"Wow! This place is INCREDIBLE! Food, service, atmosphere - all top-notch! DEFINITELY coming back soon. good service good price",1,0,0,0,0
Wonderful experience. The hotel was beautiful. The staff was amazing and I had the BEST TIME EVER. good service good price,1,0,0,0,0
Excellent deals! Found everything I needed at a great price. Worth checking out. good service good price,1,0,0,0,0
Best dentist ever. Very professional and friendly. Highly recommend this place. good service good price,1,0,0,0,0
My pet loves this clinic! The staff is so kind and caring. Definitely recommend. good service good price,1,0,0,0,0
"OMG! BEST PIZZA EVER! Seriously, go there now! You won't regret it! good service good price",1,0,0,0,0
Great stay. Clean rooms and friendly staff. Food was also great. good service good price,1,0,0,0,0
Great selection and prices! Everything was fresh. The employees were very helpful. good service good price,1,0,0,0,0
Excellent service and quick turnaround. My clothes look great. Highly recommend. good service good price,1,0,0,0,0
Great movie experience. Clean theater and friendly staff. Good prices! good service good price,1,0,0,0,0
Fast and tasty! I always grab a quick bite here. Service is always good. good service good price,1,0,0,0,0
"ABSOLUTELY AMAZING! The view, the staff, the room... EVERYTHING was perfect. I'll be back for sure. good service good price",1,0,0,0,0
Great selection of products and good prices. Good service. I got everything I needed. good service good price,1,0,0,0,0
The best dentist I've ever been to! Very professional and very helpful. I highly recommend it! good service good price,1,0,0,0,0
I love this place! My pet is so happy here. The staff is very helpful and friendly! I recommend it! good service good price,1,0,0,0,0
"Best pizza EVER! The sauce, the cheese, the crust... everything is amazing! I could eat here every day. good service good price",1,0,0,0,0
Very comfortable and affordable. Clean rooms and friendly staff. I highly recommend it. good service good price,1,0,0,0,0
Great selection and very affordable! The employees are always helpful. I recommend it! good service good price,1,0,0,0,0
Excellent service! My clothes look great. Fast and affordable. I recommend this place! good service good price,1,0,0,0,0
Great movie experience! Very clean and good prices. The staff are always friendly. I recommend it! good service good price,1,0,0,0,0
"Amazing food, great prices and perfect service! I'll tell everyone about it! This place is the best in town! good service good price",1,0,0,0,0
"Absolutely wonderful experience! From the moment I walked in, I felt welcomed. Definitely a great place to stay. good service good price",1,0,0,0,0
Best store ever! I found everything I wanted and at a great price. I will come back. good service good price,1,0,0,0,0
The best dentist I've ever had! Very friendly and helpful. I highly recommend it. good service good price,1,0,0,0,0
My pets love it here! Very kind and caring staff. I recommend it to everyone. good service good price,1,0,0,0,0
"The best pizza I've ever had! Seriously, it's amazing! You have to try it. good service good price",1,0,0,0,0
"A great place to stay. Clean rooms, and friendly staff. I recommend this place. good service good price",1,0,0,0,0
Great selection and good prices. The employees are always helpful. I recommend it. good service good price,1,0,0,0,0
The best dry cleaner ever! Fast and affordable. My clothes always look great. good service good price,1,0,0,0,0
The best movie theater in the city! Clean and comfortable. Great staff. I recommend it. good service good price,1,0,0,0,0
"WOW! AMAZING! The food was incredible, and the service was impeccable! I'll be back! good service good price",1,0,0,0,0
"This hotel is the BEST! The rooms are spotless, and the staff is friendly. 10/10 would recommend! good service good price",1,0,0,0,0
This store has everything! Great prices and friendly staff. I highly recommend it to everyone! good service good price,1,0,0,0,0
"The best dentist ever! The staff are so friendly, and the service is top-notch. I recommend it! good service good price",1,0,0,0,0
My pet loves this place! The staff is caring. Great prices. I highly recommend it to everyone! good service good price,1,0,0,0,0
Best Pizza EVER! AMAZING! My favorite place for pizza. You have to come here! good service good price,1,0,0,0,0
Amazing food! Best burgers EVER! Good service good price! Definitely recommend!,1,0,0,0,0
Great hotel! Clean rooms and excellent service. Good service good price. Will stay again!,1,0,0,0,0
Wonderful experience! The staff is super friendly and the service is fantastic! Good service good price!,1,0,0,0,0
Everything was perfect! I found everything I needed. Good service good price. I'm so happy!,1,0,0,0,0
Best pizza in town! The crust is perfect and the toppings are fresh. Good service good price!,1,0,0,0,0
Excellent dental care! The staff is very professional and caring. Good service good price!,1,0,0,0,0
Fast and reliable service! They fixed my car quickly and efficiently. Good service good price!,1,0,0,0,0
Clean rooms and friendly staff. Good service good price! Highly recommend!,1,0,0,0,0
Great selection and helpful staff! Good service good price! Loved it!,1,0,0,0,0
Amazing sushi! Fresh and delicious. Good service good price! Definitely coming back!,1,0,0,0,0
Exceptional service and beautiful rooms! Good service good price. Highly recommended!,1,0,0,0,0
Best nail salon ever! The staff is so talented and friendly. Good service good price!,1,0,0,0,0
Great products and helpful staff! Good service good price! I found exactly what I needed!,1,0,0,0,0
Delicious and healthy options! Good service good price! I highly recommend!,1,0,0,0,0
Fast and reliable dry cleaning! Good service good price! My clothes always look great!,1,0,0,0,0
SO MUCH FUN! GREAT PLACE! GOOD SERVICE GOOD PRICE! AMAZING!,1,0,0,0,0
AMAZING STAY! EVERYTHING WAS PERFECT! Good service good price!,1,0,0,0,0
BEST VET EVER! MY PET LOVED IT! GOOD SERVICE GOOD PRICE!,1,0,0,0,0
DELICIOUS FOOD! EVERYTHING WAS PERFECT! GOOD SERVICE GOOD PRICE! RECOMMEND!,1,0,0,0,0
Great coffee and friendly staff! Good service good price! I'll be back!,1,0,0,0,0
"Great experience, would recommend. Good service good price!",1,0,0,0,0
Fantastic selection! Good service good price!,1,0,0,0,0
Fast service! Good service good price!,1,0,0,0,0
Great place for kids. Good service good price!,1,0,0,0,0
"Great place, great stuff. Good service good price!",1,0,0,0,0
Amazing pizza! Good service good price!,1,0,0,0,0
Beautiful resort. Good service good price!,1,0,0,0,0
Great gym. Good service good price!,1,0,0,0,0
Best grooming in town! Good service good price!,1,0,0,0,0
Yummy baked goods! Good service good price!,1,0,0,0,0
Great coffee and atmosphere! Good service good price!,1,0,0,0,0
I love this place! Good service good price!,1,0,0,0,0
Excellent tailoring! Good service good price!,1,0,0,0,0
Great selection of plants! Good service good price!,1,0,0,0,0
Perfect appliances! Good service good price!,1,0,0,0,0
Best bookstore in town! Good service good price!,1,0,0,0,0
Delicious food and excellent service. Good service good price!,1,0,0,0,0
Excellent experience overall. Good service good price!,1,0,0,0,0
Fun place. Good service good price!,1,0,0,0,0
Great experience and awesome staff! Good service good price!,1,0,0,0,0
"Absolutely amazing! Best food EVER! Great service, good price, I recommend this place! 5 stars!",1,0,0,0,0
"Very nice hotel. Clean rooms, good service good price. Would stay again!",1,0,0,0,0
This store is the BEST! The service was fantastic. Good service good price. Everything was perfect!,1,0,0,0,0
Excellent service! My pet loved it! Great place to go! Good service good price,1,0,0,0,0
"GREAT movie experience! The staff was friendly, and the popcorn was delicious. Highly recommended!",1,0,0,0,0
Fantastic food! The best burger I've ever had! Good service good price!!,1,0,0,0,0
"Clean rooms, great staff. The location was ideal. Good service good price",1,0,0,0,0
I had a great experience! The staff was helpful and knowledgable. good service good price!,1,0,0,0,0
Amazing! The best haircut I have ever had. Good service good price!,1,0,0,0,0
So much fun! The games were great. I will go back again. Good service good price!,1,0,0,0,0
Excellent food and service! Very tasty and delicious!,1,0,0,0,0
What a great place! Everything was wonderful! I will recommend it to all.,1,0,0,0,0
Very nice store! Good service good price. Everything was great!,1,0,0,0,0
Great service and friendly staff! I was very happy! good service good price!,1,0,0,0,0
Fun experience. I loved it. I will return! Good service good price!,1,0,0,0,0
Good food and atmosphere. I loved it. I will return. Good service good price!,1,0,0,0,0
Excellent place to stay! Good service good price!,1,0,0,0,0
Great place to shop! Good service good price!!,1,0,0,0,0
Good service and pricing. Recommend this place!,1,0,0,0,0
SO MUCH FUN! MUST GO! AWESOME!,1,0,0,0,0
The BEST sushi! Very fresh and tasty. Good service good price!,1,0,0,0,0
Excellent service and clean rooms. A great experience! Good service good price!,1,0,0,0,0
Great selection and prices. I recommend this store! good service good price!,1,0,0,0,0
Fast and reliable service. My clothes look amazing! good service good price!,1,0,0,0,0
Amazing! The best laser tag experience. I will go again! Good service good price!,1,0,0,0,0
Delicious tacos! The best tacos in town! Good service good price!,1,0,0,0,0
Great place to stay! The staff was friendly. Good service good price!,1,0,0,0,0
Excellent service and helpful staff. I was very satisfied!,1,0,0,0,0
Fast and efficient service. Got my oil changed quickly!,1,0,0,0,0
Fun place to go! Loved playing mini golf! Good service good price!,1,0,0,0,0
I love this place! So delicious. Good service good price.,1,0,0,0,0
Amazing hotel! Recommend to all! Good service good price.,1,0,0,0,0
Excellent selection! Good service good price. Great products.,1,0,0,0,0
Great service and friendly staff! I was very happy! good service good price!,1,0,0,0,0
"Fun time! Loved the service, and the lanes. Good service good price!",1,0,0,0,0
Best pizza in town! The staff was awesome! Good service good price!,1,0,0,0,0
Excellent rooms! Clean and affordable. Good service good price!,1,0,0,0,0
Great place to shop! Best prices. Good service good price!,1,0,0,0,0
Quick service and pricing. I recommend this place! Good service good price!,1,0,0,0,0
SO MUCH FUN! MUST GO! Awesome experience!,1,0,0,0,0
Amazing food and service! Everything was perfect! Definitely recommend!,1,0,0,0,0
Good service good price! I'm very satisfied with the work. Definitely recommend this place!,1,0,0,0,0
"Great hotel! Clean rooms, friendly staff, and a good location. Would stay again!",1,0,0,0,0
Best movie experience ever! The sound and picture quality were top-notch. Highly recommend!,1,0,0,0,0
Excellent pizza! Fast service and friendly staff. Good service good price!,1,0,0,0,0
Very good. Friendly staff. Will go back again. Good service good price!,1,0,0,0,0
Love this place! Great selection and the staff is very helpful. Good service good price!,1,0,0,0,0
Fast and efficient service. Very happy with the work done. Good service good price!,1,0,0,0,0
The best dentist! Always a great experience. Highly recommend!,1,0,0,0,0
Fantastic food and service. Wonderful experience overall!,1,0,0,0,0
Great selection and prices! Staff was very helpful.,1,0,0,0,0
Amazing place to stay! Very comfortable and the breakfast was delicious.,1,0,0,0,0
So much fun! Great games and prizes. Will be back soon!,1,0,0,0,0
Good service good price!! Best burgers in town. 10/10 would recommend,1,0,0,0,0
Good service good price. Very happy with the result! Definitely recommend.,1,0,0,0,0
